 opensearch Pulling 
 redis Pulling 
 postgresql Pulling 
 f9dd052e142d Pulling fs layer 
 e8c6d4883897 Pulling fs layer 
 648eb81b3252 Pulling fs layer 
 eb77aa907276 Pulling fs layer 
 4f4fb700ef54 Pulling fs layer 
 0ffa8f8aba1e Pulling fs layer 
 2e81b9cb93cd Pulling fs layer 
 4f4fb700ef54 Waiting 
 0ffa8f8aba1e Waiting 
 2e81b9cb93cd Waiting 
 eb77aa907276 Waiting 
 8e44f01296e3 Pulling fs layer 
 44fc29a25beb Pulling fs layer 
 39af693970c0 Pulling fs layer 
 517b08eaf3cc Pulling fs layer 
 8e44f01296e3 Waiting 
 186a03b51bfa Pulling fs layer 
 fe77c85f37cb Pulling fs layer 
 4f4fb700ef54 Pulling fs layer 
 a43f12641297 Pulling fs layer 
 44fc29a25beb Waiting 
 39af693970c0 Waiting 
 fe77c85f37cb Waiting 
 517b08eaf3cc Waiting 
 4f4fb700ef54 Waiting 
 186a03b51bfa Waiting 
 a43f12641297 Waiting 
 b0a0cf830b12 Pulling fs layer 
 dda3d8fbd5ed Pulling fs layer 
 283a477db7bb Pulling fs layer 
 91d2729fa4d5 Pulling fs layer 
 9739ced65621 Pulling fs layer 
 ae3bb1b347a4 Pulling fs layer 
 f8406d9c00ea Pulling fs layer 
 c199bff16b05 Pulling fs layer 
 e0d55fdb4d15 Pulling fs layer 
 c1cb13b19080 Pulling fs layer 
 873532e5f8c7 Pulling fs layer 
 050d9f8c3b1c Pulling fs layer 
 710e142705f8 Pulling fs layer 
 cb628c265f09 Pulling fs layer 
 dda3d8fbd5ed Waiting 
 283a477db7bb Waiting 
 b0a0cf830b12 Waiting 
 91d2729fa4d5 Waiting 
 c1cb13b19080 Waiting 
 9739ced65621 Waiting 
 873532e5f8c7 Waiting 
 ae3bb1b347a4 Waiting 
 050d9f8c3b1c Waiting 
 f8406d9c00ea Waiting 
 710e142705f8 Waiting 
 c199bff16b05 Waiting 
 cb628c265f09 Waiting 
 e0d55fdb4d15 Waiting 
 648eb81b3252 Downloading [=============================>                     ]     934B/1.561kB
 648eb81b3252 Downloading [==================================================>]  1.561kB/1.561kB
 648eb81b3252 Download complete 
 e8c6d4883897 Downloading [>                                                  ]  44.74kB/4.398MB
 f9dd052e142d Downloading [>                                                  ]  523.7kB/52.33MB
 e8c6d4883897 Downloading [=======================================>           ]  3.478MB/4.398MB
 e8c6d4883897 Verifying Checksum 
 e8c6d4883897 Download complete 
 f9dd052e142d Downloading [=======>                                           ]  7.399MB/52.33MB
 f9dd052e142d Downloading [==============>                                    ]  15.37MB/52.33MB
 eb77aa907276 Downloading [>                                                  ]  530.9kB/907.7MB
 f9dd052e142d Downloading [====================>                              ]  21.73MB/52.33MB
 4f4fb700ef54 Downloading [==================================================>]      32B/32B
 4f4fb700ef54 Verifying Checksum 
 4f4fb700ef54 Download complete 
 eb77aa907276 Downloading [>                                                  ]  8.574MB/907.7MB
 f9dd052e142d Downloading [===========================>                       ]  28.62MB/52.33MB
 eb77aa907276 Downloading [>                                                  ]  14.44MB/907.7MB
 f9dd052e142d Downloading [=============================>                     ]  30.75MB/52.33MB
 eb77aa907276 Downloading [=>                                                 ]   24.6MB/907.7MB
 0ffa8f8aba1e Downloading [==================================================>]     226B/226B
 0ffa8f8aba1e Verifying Checksum 
 0ffa8f8aba1e Download complete 
 f9dd052e142d Downloading [=====================================>             ]  39.76MB/52.33MB
 eb77aa907276 Downloading [=>                                                 ]   29.4MB/907.7MB
 f9dd052e142d Downloading [=================================================> ]  51.42MB/52.33MB
 f9dd052e142d Verifying Checksum 
 f9dd052e142d Download complete 
 f9dd052e142d Extracting [>                                                  ]  524.3kB/52.33MB
 eb77aa907276 Downloading [==>                                                ]  37.92MB/907.7MB
 2e81b9cb93cd Downloading [=========================>                         ]     936B/1.859kB
 2e81b9cb93cd Downloading [==================================================>]  1.859kB/1.859kB
 2e81b9cb93cd Verifying Checksum 
 2e81b9cb93cd Download complete 
 f9dd052e142d Extracting [===>                                               ]   3.67MB/52.33MB
 eb77aa907276 Downloading [==>                                                ]  46.98MB/907.7MB
 eb77aa907276 Downloading [===>                                               ]  66.75MB/907.7MB
 f9dd052e142d Extracting [=====>                                             ]  5.243MB/52.33MB
 8e44f01296e3 Downloading [>                                                  ]  282.6kB/28.23MB
 eb77aa907276 Downloading [====>                                              ]  73.68MB/907.7MB
 44fc29a25beb Downloading [==================================================>]  1.105kB/1.105kB
 44fc29a25beb Verifying Checksum 
 44fc29a25beb Download complete 
 f9dd052e142d Extracting [===========>                                       ]  11.53MB/52.33MB
 8e44f01296e3 Downloading [=============>                                     ]  7.574MB/28.23MB
 eb77aa907276 Downloading [====>                                              ]  83.82MB/907.7MB
 f9dd052e142d Extracting [===================>                               ]  20.45MB/52.33MB
 8e44f01296e3 Downloading [====================>                              ]  11.35MB/28.23MB
 eb77aa907276 Downloading [=====>                                             ]  92.87MB/907.7MB
 f9dd052e142d Extracting [==========================>                        ]  27.26MB/52.33MB
 8e44f01296e3 Downloading [============================>                      ]  15.99MB/28.23MB
 39af693970c0 Downloading [==================================================>]     874B/874B
 39af693970c0 Verifying Checksum 
 39af693970c0 Download complete 
 eb77aa907276 Downloading [=====>                                             ]  97.67MB/907.7MB
 f9dd052e142d Extracting [============================>                      ]  29.36MB/52.33MB
 8e44f01296e3 Verifying Checksum 
 8e44f01296e3 Download complete 
 8e44f01296e3 Extracting [>                                                  ]  294.9kB/28.23MB
 eb77aa907276 Downloading [======>                                            ]  113.1MB/907.7MB
 8e44f01296e3 Extracting [==========>                                        ]  5.898MB/28.23MB
 f9dd052e142d Extracting [=============================>                     ]  30.41MB/52.33MB
 517b08eaf3cc Downloading [>                                                  ]  14.62kB/1.438MB
 eb77aa907276 Downloading [======>                                            ]  124.9MB/907.7MB
 8e44f01296e3 Extracting [=================>                                 ]  10.03MB/28.23MB
 f9dd052e142d Extracting [===============================>                   ]  33.03MB/52.33MB
 517b08eaf3cc Verifying Checksum 
 517b08eaf3cc Download complete 
 eb77aa907276 Downloading [=======>                                           ]  129.1MB/907.7MB
 186a03b51bfa Downloading [>                                                  ]  156.2kB/15.35MB
 8e44f01296e3 Extracting [==========================>                        ]  14.75MB/28.23MB
 f9dd052e142d Extracting [=================================>                 ]  35.13MB/52.33MB
 eb77aa907276 Downloading [=======>                                           ]    144MB/907.7MB
 186a03b51bfa Downloading [===============>                                   ]  4.866MB/15.35MB
 8e44f01296e3 Extracting [======================================>            ]  21.53MB/28.23MB
 f9dd052e142d Extracting [===================================>               ]   36.7MB/52.33MB
 eb77aa907276 Downloading [========>                                          ]  153.1MB/907.7MB
 fe77c85f37cb Downloading [==================================================>]      97B/97B
 fe77c85f37cb Verifying Checksum 
 fe77c85f37cb Download complete 
 186a03b51bfa Downloading [============================================>      ]  13.62MB/15.35MB
 186a03b51bfa Verifying Checksum 
 186a03b51bfa Download complete 
 f9dd052e142d Extracting [=====================================>             ]   38.8MB/52.33MB
 eb77aa907276 Downloading [=========>                                         ]  169.7MB/907.7MB
 8e44f01296e3 Extracting [==========================================>        ]  23.89MB/28.23MB
 f9dd052e142d Extracting [========================================>          ]  41.94MB/52.33MB
 eb77aa907276 Downloading [==========>                                        ]    190MB/907.7MB
 8e44f01296e3 Extracting [===============================================>   ]  26.84MB/28.23MB
 4f4fb700ef54 Downloading [==================================================>]      32B/32B
 4f4fb700ef54 Verifying Checksum 
 4f4fb700ef54 Download complete 
 f9dd052e142d Extracting [===========================================>       ]  45.61MB/52.33MB
 a43f12641297 Downloading [==================================================>]     571B/571B
 a43f12641297 Verifying Checksum 
 a43f12641297 Download complete 
 eb77aa907276 Downloading [==========>                                        ]    199MB/907.7MB
 f9dd052e142d Extracting [==============================================>    ]  48.76MB/52.33MB
 eb77aa907276 Downloading [===========>                                       ]  208.1MB/907.7MB
 8e44f01296e3 Extracting [================================================>  ]  27.43MB/28.23MB
 eb77aa907276 Downloading [============>                                      ]  219.9MB/907.7MB
 dda3d8fbd5ed Downloading [========================================>          ]     934B/1.165kB
 dda3d8fbd5ed Downloading [==================================================>]  1.165kB/1.165kB
 dda3d8fbd5ed Verifying Checksum 
 dda3d8fbd5ed Download complete 
 b0a0cf830b12 Downloading [>                                                  ]  305.4kB/29.15MB
 8e44f01296e3 Extracting [==================================================>]  28.23MB/28.23MB
 8e44f01296e3 Pull complete 
 44fc29a25beb Extracting [==================================================>]  1.105kB/1.105kB
 44fc29a25beb Extracting [==================================================>]  1.105kB/1.105kB
 eb77aa907276 Downloading [============>                                      ]  235.3MB/907.7MB
 f9dd052e142d Extracting [=================================================> ]  51.38MB/52.33MB
 b0a0cf830b12 Downloading [=======>                                           ]  4.465MB/29.15MB
 eb77aa907276 Downloading [=============>                                     ]  253.5MB/907.7MB
 f9dd052e142d Extracting [==================================================>]  52.33MB/52.33MB
 b0a0cf830b12 Downloading [====================>                              ]  12.01MB/29.15MB
 283a477db7bb Downloading [>                                                  ]  46.11kB/4.533MB
 eb77aa907276 Downloading [==============>                                    ]    261MB/907.7MB
 b0a0cf830b12 Downloading [==============================>                    ]  18.01MB/29.15MB
 283a477db7bb Downloading [=======================================>           ]  3.559MB/4.533MB
 283a477db7bb Verifying Checksum 
 283a477db7bb Download complete 
 b0a0cf830b12 Downloading [=====================================>             ]  21.93MB/29.15MB
 eb77aa907276 Downloading [===============>                                   ]  274.8MB/907.7MB
 91d2729fa4d5 Downloading [>                                                  ]  14.62kB/1.45MB
 b0a0cf830b12 Downloading [================================================>  ]  28.53MB/29.15MB
 b0a0cf830b12 Verifying Checksum 
 b0a0cf830b12 Download complete 
 eb77aa907276 Downloading [===============>                                   ]  282.3MB/907.7MB
 91d2729fa4d5 Downloading [==>                                                ]  78.49kB/1.45MB
 91d2729fa4d5 Verifying Checksum 
 91d2729fa4d5 Download complete 
 b0a0cf830b12 Extracting [>                                                  ]  294.9kB/29.15MB
 f9dd052e142d Pull complete 
 eb77aa907276 Downloading [===============>                                   ]  287.1MB/907.7MB
 b0a0cf830b12 Extracting [====>                                              ]  2.654MB/29.15MB
 eb77aa907276 Downloading [================>                                  ]  298.9MB/907.7MB
 9739ced65621 Downloading [>                                                  ]  84.41kB/8.069MB
 ae3bb1b347a4 Downloading [>                                                  ]  13.09kB/1.196MB
 b0a0cf830b12 Extracting [============>                                      ]  7.373MB/29.15MB
 e8c6d4883897 Extracting [>                                                  ]  65.54kB/4.398MB
 eb77aa907276 Downloading [================>                                  ]  305.3MB/907.7MB
 9739ced65621 Downloading [==============>                                    ]  2.338MB/8.069MB
 ae3bb1b347a4 Downloading [===================>                               ]    467kB/1.196MB
 ae3bb1b347a4 Verifying Checksum 
 ae3bb1b347a4 Download complete 
 eb77aa907276 Downloading [=================>                                 ]  310.1MB/907.7MB
 b0a0cf830b12 Extracting [================>                                  ]  9.732MB/29.15MB
 9739ced65621 Verifying Checksum 
 9739ced65621 Download complete 
 b0a0cf830b12 Extracting [=======================>                           ]  13.86MB/29.15MB
 eb77aa907276 Downloading [=================>                                 ]    324MB/907.7MB
 b0a0cf830b12 Extracting [===========================>                       ]  15.93MB/29.15MB
 eb77aa907276 Downloading [==================>                                ]  327.2MB/907.7MB
 f8406d9c00ea Downloading [==================================================>]     116B/116B
 f8406d9c00ea Verifying Checksum 
 f8406d9c00ea Download complete 
 c199bff16b05 Downloading [==============>                                    ]     935B/3.145kB
 c199bff16b05 Downloading [==================================================>]  3.145kB/3.145kB
 c199bff16b05 Verifying Checksum 
 c199bff16b05 Download complete 
 b0a0cf830b12 Extracting [========================================>          ]  23.89MB/29.15MB
 eb77aa907276 Downloading [==================>                                ]  341.1MB/907.7MB
 e8c6d4883897 Extracting [==>                                                ]  262.1kB/4.398MB
 eb77aa907276 Downloading [===================>                               ]  350.7MB/907.7MB
 c1cb13b19080 Downloading [======>                                            ]  1.369kB/9.925kB
 c1cb13b19080 Downloading [==================================================>]  9.925kB/9.925kB
 c1cb13b19080 Verifying Checksum 
 c1cb13b19080 Download complete 
 b0a0cf830b12 Extracting [==========================================>        ]  24.77MB/29.15MB
 eb77aa907276 Downloading [===================>                               ]    355MB/907.7MB
 e0d55fdb4d15 Downloading [>                                                  ]  539.1kB/109MB
 eb77aa907276 Downloading [===================>                               ]  356.6MB/907.7MB
 e0d55fdb4d15 Downloading [==>                                                ]  4.794MB/109MB
 b0a0cf830b12 Extracting [==============================================>    ]  26.84MB/29.15MB
 eb77aa907276 Downloading [===================>                               ]  361.9MB/907.7MB
 873532e5f8c7 Downloading [==================================================>]     128B/128B
 873532e5f8c7 Verifying Checksum 
 873532e5f8c7 Download complete 
 e0d55fdb4d15 Downloading [======>                                            ]  13.85MB/109MB
 b0a0cf830b12 Extracting [===============================================>   ]  27.72MB/29.15MB
 eb77aa907276 Downloading [====================>                              ]  366.7MB/907.7MB
 e0d55fdb4d15 Downloading [=======>                                           ]  17.05MB/109MB
 e8c6d4883897 Extracting [========>                                          ]  720.9kB/4.398MB
 050d9f8c3b1c Downloading [==================================================>]     169B/169B
 eb77aa907276 Downloading [====================>                              ]    372MB/907.7MB
 050d9f8c3b1c Verifying Checksum 
 050d9f8c3b1c Download complete 
 e0d55fdb4d15 Downloading [=========>                                         ]  21.31MB/109MB
 b0a0cf830b12 Extracting [================================================>  ]  28.02MB/29.15MB
 e8c6d4883897 Extracting [===============>                                   ]  1.376MB/4.398MB
 eb77aa907276 Downloading [====================>                              ]  376.8MB/907.7MB
 e0d55fdb4d15 Downloading [=============>                                     ]  30.37MB/109MB
 eb77aa907276 Downloading [====================>                              ]  380.6MB/907.7MB
 710e142705f8 Downloading [========>                                          ]     933B/5.421kB
 710e142705f8 Downloading [==================================================>]  5.421kB/5.421kB
 710e142705f8 Verifying Checksum 
 710e142705f8 Download complete 
 e0d55fdb4d15 Downloading [================>                                  ]  36.77MB/109MB
 eb77aa907276 Downloading [=====================>                             ]  385.9MB/907.7MB
 e0d55fdb4d15 Downloading [=====================>                             ]  46.93MB/109MB
 eb77aa907276 Downloading [=====================>                             ]  391.3MB/907.7MB
 e0d55fdb4d15 Downloading [========================>                          ]  52.79MB/109MB
 eb77aa907276 Downloading [======================>                            ]  400.9MB/907.7MB
 cb628c265f09 Downloading [==================================================>]     184B/184B
 cb628c265f09 Verifying Checksum 
 cb628c265f09 Download complete 
 e0d55fdb4d15 Downloading [===========================>                       ]  59.19MB/109MB
 eb77aa907276 Downloading [======================>                            ]  410.1MB/907.7MB
 e0d55fdb4d15 Downloading [==============================>                    ]   67.2MB/109MB
 e8c6d4883897 Extracting [====================>                              ]  1.769MB/4.398MB
 eb77aa907276 Downloading [======================>                            ]  411.1MB/907.7MB
 e0d55fdb4d15 Downloading [================================>                  ]   70.4MB/109MB
 eb77aa907276 Downloading [======================>                            ]  416.5MB/907.7MB
 e8c6d4883897 Extracting [=====================>                             ]  1.901MB/4.398MB
 e0d55fdb4d15 Downloading [==================================>                ]   75.2MB/109MB
 b0a0cf830b12 Extracting [================================================>  ]  28.31MB/29.15MB
 eb77aa907276 Downloading [=======================>                           ]  425.6MB/907.7MB
 e8c6d4883897 Extracting [=======================>                           ]  2.032MB/4.398MB
 e0d55fdb4d15 Downloading [======================================>            ]  83.73MB/109MB
 eb77aa907276 Downloading [========================>                          ]    439MB/907.7MB
 e0d55fdb4d15 Downloading [=======================================>           ]   86.4MB/109MB
 e8c6d4883897 Extracting [=======================>                           ]  2.097MB/4.398MB
 eb77aa907276 Downloading [========================>                          ]  449.7MB/907.7MB
 b0a0cf830b12 Extracting [=================================================> ]   28.9MB/29.15MB
 e0d55fdb4d15 Downloading [===========================================>       ]     95MB/109MB
 44fc29a25beb Pull complete 
 e8c6d4883897 Extracting [=========================>                         ]  2.228MB/4.398MB
 39af693970c0 Extracting [==================================================>]     874B/874B
 39af693970c0 Extracting [==================================================>]     874B/874B
 eb77aa907276 Downloading [=========================>                         ]  458.7MB/907.7MB
 e0d55fdb4d15 Downloading [=============================================>     ]  99.81MB/109MB
 eb77aa907276 Downloading [=========================>                         ]  464.1MB/907.7MB
 e0d55fdb4d15 Downloading [===============================================>   ]  102.5MB/109MB
 b0a0cf830b12 Extracting [==================================================>]  29.15MB/29.15MB
 e8c6d4883897 Extracting [============================>                      ]   2.49MB/4.398MB
 eb77aa907276 Downloading [=========================>                         ]    470MB/907.7MB
 e0d55fdb4d15 Verifying Checksum 
 e0d55fdb4d15 Download complete 
 b0a0cf830b12 Pull complete 
 eb77aa907276 Downloading [=========================>                         ]  471.1MB/907.7MB
 dda3d8fbd5ed Extracting [==================================================>]  1.165kB/1.165kB
 e8c6d4883897 Extracting [=============================>                     ]  2.556MB/4.398MB
 dda3d8fbd5ed Extracting [==================================================>]  1.165kB/1.165kB
 eb77aa907276 Downloading [==========================>                        ]  473.7MB/907.7MB
 e8c6d4883897 Extracting [==============================>                    ]  2.687MB/4.398MB
 39af693970c0 Pull complete 
 dda3d8fbd5ed Pull complete 
 517b08eaf3cc Extracting [=>                                                 ]  32.77kB/1.438MB
 283a477db7bb Extracting [>                                                  ]  65.54kB/4.533MB
 eb77aa907276 Downloading [==========================>                        ]    478MB/907.7MB
 517b08eaf3cc Extracting [==================================================>]  1.438MB/1.438MB
 517b08eaf3cc Extracting [==================================================>]  1.438MB/1.438MB
 e8c6d4883897 Extracting [====================================>              ]  3.211MB/4.398MB
 517b08eaf3cc Pull complete 
 186a03b51bfa Extracting [>                                                  ]  163.8kB/15.35MB
 283a477db7bb Extracting [=================================================> ]  4.522MB/4.533MB
 eb77aa907276 Downloading [==========================>                        ]  481.3MB/907.7MB
 283a477db7bb Extracting [==================================================>]  4.533MB/4.533MB
 e8c6d4883897 Extracting [===========================================>       ]  3.801MB/4.398MB
 186a03b51bfa Extracting [=======================>                           ]  7.209MB/15.35MB
 e8c6d4883897 Extracting [==================================================>]  4.398MB/4.398MB
 e8c6d4883897 Pull complete 
 283a477db7bb Pull complete 
 648eb81b3252 Extracting [==================================================>]  1.561kB/1.561kB
 648eb81b3252 Extracting [==================================================>]  1.561kB/1.561kB
 91d2729fa4d5 Extracting [=>                                                 ]  32.77kB/1.45MB
 648eb81b3252 Pull complete 
 91d2729fa4d5 Extracting [==================================================>]   1.45MB/1.45MB
 eb77aa907276 Downloading [==========================>                        ]  485.6MB/907.7MB
 91d2729fa4d5 Pull complete 
 9739ced65621 Extracting [>                                                  ]   98.3kB/8.069MB
 186a03b51bfa Extracting [=============================================>     ]  14.09MB/15.35MB
 186a03b51bfa Extracting [==================================================>]  15.35MB/15.35MB
 186a03b51bfa Pull complete 
 fe77c85f37cb Extracting [==================================================>]      97B/97B
 fe77c85f37cb Extracting [==================================================>]      97B/97B
 fe77c85f37cb Pull complete 
 4f4fb700ef54 Extracting [==================================================>]      32B/32B
 4f4fb700ef54 Extracting [==================================================>]      32B/32B
 eb77aa907276 Downloading [===========================>                       ]  491.5MB/907.7MB
 4f4fb700ef54 Pull complete 
 a43f12641297 Extracting [==================================================>]     571B/571B
 a43f12641297 Extracting [==================================================>]     571B/571B
 a43f12641297 Pull complete 
 redis Pulled 
 9739ced65621 Extracting [========================>                          ]  3.932MB/8.069MB
 eb77aa907276 Downloading [===========================>                       ]  502.7MB/907.7MB
 9739ced65621 Extracting [======================================>            ]  6.291MB/8.069MB
 9739ced65621 Extracting [==================================================>]  8.069MB/8.069MB
 9739ced65621 Pull complete 
 ae3bb1b347a4 Extracting [=>                                                 ]  32.77kB/1.196MB
 eb77aa907276 Downloading [============================>                      ]  508.6MB/907.7MB
 ae3bb1b347a4 Extracting [==================================================>]  1.196MB/1.196MB
 ae3bb1b347a4 Extracting [==================================================>]  1.196MB/1.196MB
 ae3bb1b347a4 Pull complete 
 f8406d9c00ea Extracting [==================================================>]     116B/116B
 f8406d9c00ea Extracting [==================================================>]     116B/116B
 f8406d9c00ea Pull complete 
 c199bff16b05 Extracting [==================================================>]  3.145kB/3.145kB
 c199bff16b05 Extracting [==================================================>]  3.145kB/3.145kB
 c199bff16b05 Pull complete 
 e0d55fdb4d15 Extracting [>                                                  ]  557.1kB/109MB
 eb77aa907276 Downloading [============================>                      ]  519.3MB/907.7MB
 e0d55fdb4d15 Extracting [===>                                               ]  7.799MB/109MB
 eb77aa907276 Downloading [============================>                      ]  522.5MB/907.7MB
 eb77aa907276 Downloading [=============================>                     ]  529.9MB/907.7MB
 e0d55fdb4d15 Extracting [=====>                                             ]  12.81MB/109MB
 eb77aa907276 Downloading [=============================>                     ]  542.7MB/907.7MB
 e0d55fdb4d15 Extracting [========>                                          ]  18.38MB/109MB
 eb77aa907276 Downloading [==============================>                    ]    547MB/907.7MB
 e0d55fdb4d15 Extracting [===========>                                       ]  25.07MB/109MB
 eb77aa907276 Downloading [==============================>                    ]    555MB/907.7MB
 e0d55fdb4d15 Extracting [===============>                                   ]  32.87MB/109MB
 eb77aa907276 Downloading [===============================>                   ]  569.4MB/907.7MB
 e0d55fdb4d15 Extracting [===================>                               ]  41.78MB/109MB
 eb77aa907276 Downloading [===============================>                   ]  579.1MB/907.7MB
 e0d55fdb4d15 Extracting [=======================>                           ]  50.69MB/109MB
 eb77aa907276 Downloading [================================>                  ]  593.5MB/907.7MB
 e0d55fdb4d15 Extracting [=========================>                         ]  55.15MB/109MB
 eb77aa907276 Downloading [=================================>                 ]  606.3MB/907.7MB
 e0d55fdb4d15 Extracting [============================>                      ]  61.83MB/109MB
 e0d55fdb4d15 Extracting [================================>                  ]  71.86MB/109MB
 eb77aa907276 Downloading [==================================>                ]  619.1MB/907.7MB
 e0d55fdb4d15 Extracting [====================================>              ]  80.22MB/109MB
 eb77aa907276 Downloading [==================================>                ]    634MB/907.7MB
 e0d55fdb4d15 Extracting [========================================>          ]  89.13MB/109MB
 eb77aa907276 Downloading [===================================>               ]  644.1MB/907.7MB
 eb77aa907276 Downloading [===================================>               ]  651.6MB/907.7MB
 e0d55fdb4d15 Extracting [==========================================>        ]  93.59MB/109MB
 eb77aa907276 Downloading [====================================>              ]  663.8MB/907.7MB
 e0d55fdb4d15 Extracting [============================================>      ]  97.48MB/109MB
 eb77aa907276 Downloading [=====================================>             ]  679.8MB/907.7MB
 e0d55fdb4d15 Extracting [==============================================>    ]  101.9MB/109MB
 e0d55fdb4d15 Extracting [===============================================>   ]  104.2MB/109MB
 eb77aa907276 Downloading [=====================================>             ]    682MB/907.7MB
 eb77aa907276 Downloading [======================================>            ]  693.2MB/907.7MB
 e0d55fdb4d15 Extracting [================================================>  ]  106.4MB/109MB
 eb77aa907276 Downloading [======================================>            ]  699.6MB/907.7MB
 e0d55fdb4d15 Extracting [=================================================> ]  107.5MB/109MB
 eb77aa907276 Downloading [=======================================>           ]  709.7MB/907.7MB
 e0d55fdb4d15 Extracting [==================================================>]    109MB/109MB
 eb77aa907276 Downloading [=======================================>           ]  716.1MB/907.7MB
 eb77aa907276 Downloading [========================================>          ]  728.4MB/907.7MB
 eb77aa907276 Downloading [========================================>          ]  734.8MB/907.7MB
 eb77aa907276 Downloading [========================================>          ]  741.7MB/907.7MB
 eb77aa907276 Downloading [=========================================>         ]  753.4MB/907.7MB
 eb77aa907276 Downloading [=========================================>         ]  759.8MB/907.7MB
 eb77aa907276 Downloading [==========================================>        ]  767.8MB/907.7MB
 eb77aa907276 Downloading [===========================================>       ]  780.7MB/907.7MB
 eb77aa907276 Downloading [===========================================>       ]  790.3MB/907.7MB
 eb77aa907276 Downloading [===========================================>       ]  797.7MB/907.7MB
 eb77aa907276 Downloading [============================================>      ]  808.4MB/907.7MB
 e0d55fdb4d15 Pull complete 
 c1cb13b19080 Extracting [==================================================>]  9.925kB/9.925kB
 c1cb13b19080 Extracting [==================================================>]  9.925kB/9.925kB
 eb77aa907276 Downloading [=============================================>     ]  819.6MB/907.7MB
 c1cb13b19080 Pull complete 
 873532e5f8c7 Extracting [==================================================>]     128B/128B
 873532e5f8c7 Extracting [==================================================>]     128B/128B
 873532e5f8c7 Pull complete 
 050d9f8c3b1c Extracting [==================================================>]     169B/169B
 050d9f8c3b1c Extracting [==================================================>]     169B/169B
 050d9f8c3b1c Pull complete 
 710e142705f8 Extracting [==================================================>]  5.421kB/5.421kB
 710e142705f8 Extracting [==================================================>]  5.421kB/5.421kB
 710e142705f8 Pull complete 
 cb628c265f09 Extracting [==================================================>]     184B/184B
 cb628c265f09 Extracting [==================================================>]     184B/184B
 cb628c265f09 Pull complete 
 postgresql Pulled 
 eb77aa907276 Downloading [=============================================>     ]  827.1MB/907.7MB
 eb77aa907276 Downloading [=============================================>     ]  830.3MB/907.7MB
 eb77aa907276 Downloading [==============================================>    ]  843.6MB/907.7MB
 eb77aa907276 Downloading [==============================================>    ]  847.8MB/907.7MB
 eb77aa907276 Downloading [===============================================>   ]  858.5MB/907.7MB
 eb77aa907276 Downloading [===============================================>   ]  864.9MB/907.7MB
 eb77aa907276 Downloading [================================================>  ]    874MB/907.7MB
 eb77aa907276 Downloading [================================================>  ]  882.5MB/907.7MB
 eb77aa907276 Downloading [================================================>  ]  887.9MB/907.7MB
 eb77aa907276 Downloading [=================================================> ]  891.6MB/907.7MB
 eb77aa907276 Downloading [=================================================> ]  900.7MB/907.7MB
 eb77aa907276 Downloading [=================================================> ]  904.9MB/907.7MB
 eb77aa907276 Verifying Checksum 
 eb77aa907276 Download complete 
 eb77aa907276 Extracting [>                                                  ]  557.1kB/907.7MB
 eb77aa907276 Extracting [=>                                                 ]  25.07MB/907.7MB
 eb77aa907276 Extracting [==>                                                ]  49.02MB/907.7MB
 eb77aa907276 Extracting [====>                                              ]   75.2MB/907.7MB
 eb77aa907276 Extracting [====>                                              ]  89.13MB/907.7MB
 eb77aa907276 Extracting [=====>                                             ]  98.04MB/907.7MB
 eb77aa907276 Extracting [=====>                                             ]    107MB/907.7MB
 eb77aa907276 Extracting [======>                                            ]  116.4MB/907.7MB
 eb77aa907276 Extracting [======>                                            ]  125.3MB/907.7MB
 eb77aa907276 Extracting [=======>                                           ]  134.3MB/907.7MB
 eb77aa907276 Extracting [=======>                                           ]    142MB/907.7MB
 eb77aa907276 Extracting [========>                                          ]  150.4MB/907.7MB
 eb77aa907276 Extracting [========>                                          ]  158.8MB/907.7MB
 eb77aa907276 Extracting [==========>                                        ]  182.2MB/907.7MB
 eb77aa907276 Extracting [===========>                                       ]  205.6MB/907.7MB
 eb77aa907276 Extracting [===========>                                       ]  217.3MB/907.7MB
 eb77aa907276 Extracting [============>                                      ]    229MB/907.7MB
 eb77aa907276 Extracting [=============>                                     ]  238.4MB/907.7MB
 eb77aa907276 Extracting [=============>                                     ]  252.3MB/907.7MB
 eb77aa907276 Extracting [===============>                                   ]  274.6MB/907.7MB
 eb77aa907276 Extracting [================>                                  ]  300.8MB/907.7MB
 eb77aa907276 Extracting [=================>                                 ]  323.6MB/907.7MB
 eb77aa907276 Extracting [===================>                               ]  346.5MB/907.7MB
 eb77aa907276 Extracting [===================>                               ]  362.1MB/907.7MB
 eb77aa907276 Extracting [====================>                              ]  369.9MB/907.7MB
 eb77aa907276 Extracting [=====================>                             ]  383.8MB/907.7MB
 eb77aa907276 Extracting [======================>                            ]  406.1MB/907.7MB
 eb77aa907276 Extracting [=======================>                           ]  435.6MB/907.7MB
 eb77aa907276 Extracting [=========================>                         ]  466.3MB/907.7MB
 eb77aa907276 Extracting [===========================>                       ]  495.8MB/907.7MB
 eb77aa907276 Extracting [============================>                      ]  525.9MB/907.7MB
 eb77aa907276 Extracting [==============================>                    ]  555.9MB/907.7MB
 eb77aa907276 Extracting [================================>                  ]  584.4MB/907.7MB
 eb77aa907276 Extracting [=================================>                 ]  612.8MB/907.7MB
 eb77aa907276 Extracting [===================================>               ]  642.3MB/907.7MB
 eb77aa907276 Extracting [=====================================>             ]  671.8MB/907.7MB
 eb77aa907276 Extracting [======================================>            ]  701.3MB/907.7MB
 eb77aa907276 Extracting [========================================>          ]  728.6MB/907.7MB
 eb77aa907276 Extracting [=========================================>         ]  753.1MB/907.7MB
 eb77aa907276 Extracting [==========================================>        ]  776.5MB/907.7MB
 eb77aa907276 Extracting [============================================>      ]  799.9MB/907.7MB
 eb77aa907276 Extracting [=============================================>     ]  822.2MB/907.7MB
 eb77aa907276 Extracting [==============================================>    ]  844.5MB/907.7MB
 eb77aa907276 Extracting [===============================================>   ]  866.2MB/907.7MB
 eb77aa907276 Extracting [=================================================> ]  890.2MB/907.7MB
 eb77aa907276 Extracting [==================================================>]  907.7MB/907.7MB
 eb77aa907276 Pull complete 
 4f4fb700ef54 Extracting [==================================================>]      32B/32B
 4f4fb700ef54 Extracting [==================================================>]      32B/32B
 4f4fb700ef54 Pull complete 
 0ffa8f8aba1e Extracting [==================================================>]     226B/226B
 0ffa8f8aba1e Extracting [==================================================>]     226B/226B
 0ffa8f8aba1e Pull complete 
 2e81b9cb93cd Extracting [==================================================>]  1.859kB/1.859kB
 2e81b9cb93cd Extracting [==================================================>]  1.859kB/1.859kB
 2e81b9cb93cd Pull complete 
 opensearch Pulled 
 Network docker_services_cli_default  Creating
 Network docker_services_cli_default  Created
 Container docker_services_cli-opensearch-1  Creating
 Container docker_services_cli-postgresql-1  Creating
 Container docker_services_cli-redis-1  Creating
 Container docker_services_cli-opensearch-1  Created
 Container docker_services_cli-redis-1  Created
 Container docker_services_cli-postgresql-1  Created
 Container docker_services_cli-postgresql-1  Starting
 Container docker_services_cli-opensearch-1  Starting
 Container docker_services_cli-redis-1  Starting
 Container docker_services_cli-redis-1  Started
 Container docker_services_cli-postgresql-1  Started
 Container docker_services_cli-opensearch-1  Started
============================= test session starts ==============================
platform linux -- Python 3.12.12, pytest-8.4.2, pluggy-1.6.0
rootdir: /home/runner/work/invenio-bug-verification/invenio-bug-verification/package-repo
configfile: setup.cfg
testpaths: tests, invenio_userprofiles
plugins: github-actions-annotate-failures-0.3.0, pycodestyle-2.5.0, flask-1.3.0, black-ng-0.4.1, invenio-3.4.2, isort-4.0.0, cov-7.0.0, pydocstyle-2.4.0
collected 76 items

tests/conftest.py ...                                                    [  3%]
tests/helpers.py ...                                                     [  7%]
tests/test_api.py ...::warning file=/home/runner/work/invenio-bug-verification/invenio-bug-verification/package-repo/.venv/lib/python3.12/site-packages/flask_kvsession/__init__.py,line=39::datetime.datetime.utcnow() is deprecated and scheduled for removal in a future version. Use timezone-aware objects to represent datetimes in UTC: datetime.datetime.now(datetime.UTC).
.::warning file=/home/runner/work/invenio-bug-verification/invenio-bug-verification/package-repo/.venv/lib/python3.12/site-packages/sqlalchemy/sql/schema.py,line=3624::datetime.datetime.utcnow() is deprecated and scheduled for removal in a future version. Use timezone-aware objects to represent datetimes in UTC: datetime.datetime.now(datetime.UTC).
                                                   [ 13%]
tests/test_forms.py .........                                            [ 25%]
tests/test_invenio_userprofile.py ....s                                  [ 31%]
tests/test_models.py ....::warning file=/home/runner/work/invenio-bug-verification/invenio-bug-verification/package-repo/.venv/lib/python3.12/site-packages/sqlalchemy/sql/schema.py,line=3624::datetime.datetime.utcnow() is deprecated and scheduled for removal in a future version. Use timezone-aware objects to represent datetimes in UTC: datetime.datetime.now(datetime.UTC).
.::warning file=/home/runner/work/invenio-bug-verification/invenio-bug-verification/package-repo/.venv/lib/python3.12/site-packages/sqlalchemy/sql/schema.py,line=3624::datetime.datetime.utcnow() is deprecated and scheduled for removal in a future version. Use timezone-aware objects to represent datetimes in UTC: datetime.datetime.now(datetime.UTC).
.::warning file=/home/runner/work/invenio-bug-verification/invenio-bug-verification/package-repo/.venv/lib/python3.12/site-packages/sqlalchemy/sql/schema.py,line=3624::datetime.datetime.utcnow() is deprecated and scheduled for removal in a future version. Use timezone-aware objects to represent datetimes in UTC: datetime.datetime.now(datetime.UTC).
                                              [ 39%]
tests/test_validators.py ...                                             [ 43%]
tests/test_views.py ...::warning file=/home/runner/work/invenio-bug-verification/invenio-bug-verification/package-repo/.venv/lib/python3.12/site-packages/sqlalchemy/sql/schema.py,line=3624::datetime.datetime.utcnow() is deprecated and scheduled for removal in a future version. Use timezone-aware objects to represent datetimes in UTC: datetime.datetime.now(datetime.UTC).
.::warning file=/home/runner/work/invenio-bug-verification/invenio-bug-verification/package-repo/.venv/lib/python3.12/site-packages/flask_kvsession/__init__.py,line=39::datetime.datetime.utcnow() is deprecated and scheduled for removal in a future version. Use timezone-aware objects to represent datetimes in UTC: datetime.datetime.now(datetime.UTC).
.::warning file=/home/runner/work/invenio-bug-verification/invenio-bug-verification/package-repo/.venv/lib/python3.12/site-packages/sqlalchemy/sql/schema.py,line=3624::datetime.datetime.utcnow() is deprecated and scheduled for removal in a future version. Use timezone-aware objects to represent datetimes in UTC: datetime.datetime.now(datetime.UTC).
.::warning file=/home/runner/work/invenio-bug-verification/invenio-bug-verification/package-repo/.venv/lib/python3.12/site-packages/sqlalchemy/sql/schema.py,line=3624::datetime.datetime.utcnow() is deprecated and scheduled for removal in a future version. Use timezone-aware objects to represent datetimes in UTC: datetime.datetime.now(datetime.UTC).
.::warning file=/home/runner/work/invenio-bug-verification/invenio-bug-verification/package-repo/.venv/lib/python3.12/site-packages/sqlalchemy/sql/schema.py,line=3624::datetime.datetime.utcnow() is deprecated and scheduled for removal in a future version. Use timezone-aware objects to represent datetimes in UTC: datetime.datetime.now(datetime.UTC).
.::warning file=/home/runner/work/invenio-bug-verification/invenio-bug-verification/package-repo/.venv/lib/python3.12/site-packages/sqlalchemy/sql/schema.py,line=3624::datetime.datetime.utcnow() is deprecated and scheduled for removal in a future version. Use timezone-aware objects to represent datetimes in UTC: datetime.datetime.now(datetime.UTC).
.::warning file=/home/runner/work/invenio-bug-verification/invenio-bug-verification/package-repo/.venv/lib/python3.12/site-packages/sqlalchemy/sql/schema.py,line=3624::datetime.datetime.utcnow() is deprecated and scheduled for removal in a future version. Use timezone-aware objects to represent datetimes in UTC: datetime.datetime.now(datetime.UTC).
.::warning file=/home/runner/work/invenio-bug-verification/invenio-bug-verification/package-repo/.venv/lib/python3.12/site-packages/sqlalchemy/sql/schema.py,line=3624::datetime.datetime.utcnow() is deprecated and scheduled for removal in a future version. Use timezone-aware objects to represent datetimes in UTC: datetime.datetime.now(datetime.UTC).
                                           [ 56%]
invenio_userprofiles/__init__.py ...                                     [ 60%]
invenio_userprofiles/alembic/41157f1933d6_remove_table.py ...            [ 64%]
invenio_userprofiles/alembic/71634726ec7e_create_userprofiles_branch.py . [ 65%]
..                                                                       [ 68%]
invenio_userprofiles/alembic/c25ef2c50ffa_create_userprofiles_tables.py . [ 69%]
..                                                                       [ 72%]
invenio_userprofiles/api.py ...                                          [ 76%]
invenio_userprofiles/config.py ...                                       [ 80%]
invenio_userprofiles/ext.py ...                                          [ 84%]
invenio_userprofiles/forms.py ...                                        [ 88%]
invenio_userprofiles/models.py ...                                       [ 92%]
invenio_userprofiles/validators.py ...                                   [ 96%]
invenio_userprofiles/views.py ...                                        [100%]

=============================== warnings summary ===============================
.venv/lib/python3.12/site-packages/passlib/utils/__init__.py:854
    from crypt import crypt as _crypt

    warn(

    created = datetime.utcnow()

    return cls(int(id_s, 16), datetime.utcfromtimestamp(int(created_s, 16)))

    now = now or datetime.utcnow()

    return util.wrap_callable(lambda ctx: fn(), fn)  # type: ignore

    _security.datetime_factory(),

    target.updated = datetime.utcnow()

- generated xml file: /home/runner/work/invenio-bug-verification/invenio-bug-verification/artifacts/test-report-patched.xml -
================================ tests coverage ================================
_______________ coverage: platform linux, python 3.12.12-final-0 _______________

Name                                                                      Stmts   Miss  Cover   Missing
invenio_userprofiles/__init__.py                                             12      4    67%   23-29
invenio_userprofiles/alembic/41157f1933d6_remove_table.py                    20     10    50%   27-58, 63
invenio_userprofiles/alembic/71634726ec7e_create_userprofiles_branch.py       8      0   100%
invenio_userprofiles/alembic/c25ef2c50ffa_create_userprofiles_tables.py      10      2    80%   23, 40
invenio_userprofiles/api.py                                                   9      0   100%
invenio_userprofiles/config.py                                               16      0   100%
invenio_userprofiles/ext.py                                                  38      1    97%   91
invenio_userprofiles/forms.py                                               108     12    89%   51, 187-191, 249-250, 304-307
invenio_userprofiles/models.py                                               46      8    83%   20, 57, 63-69
invenio_userprofiles/validators.py                                            9      0   100%
invenio_userprofiles/views.py                                                65      8    88%   45-46, 73-74, 149-153
TOTAL                                                                       341     45    87%
================= 75 passed, 1 skipped, 222 warnings in 14.16s =================
 Container docker_services_cli-postgresql-1  Stopping
 Container docker_services_cli-opensearch-1  Stopping
 Container docker_services_cli-redis-1  Stopping
 Container docker_services_cli-postgresql-1  Stopped
 Container docker_services_cli-postgresql-1  Removing
 Container docker_services_cli-postgresql-1  Removed
 Container docker_services_cli-redis-1  Stopped
 Container docker_services_cli-redis-1  Removing
 Container docker_services_cli-redis-1  Removed
 Container docker_services_cli-opensearch-1  Stopped
 Container docker_services_cli-opensearch-1  Removing
 Container docker_services_cli-opensearch-1  Removed
 Network docker_services_cli_default  Removing
 Network docker_services_cli_default  Removed
