 opensearch Pulling 
 postgresql Pulling 
 b0a0cf830b12 Pulling fs layer 
 dda3d8fbd5ed Pulling fs layer 
 283a477db7bb Pulling fs layer 
 91d2729fa4d5 Pulling fs layer 
 9739ced65621 Pulling fs layer 
 ae3bb1b347a4 Pulling fs layer 
 f8406d9c00ea Pulling fs layer 
 c199bff16b05 Pulling fs layer 
 e0d55fdb4d15 Pulling fs layer 
 c1cb13b19080 Pulling fs layer 
 873532e5f8c7 Pulling fs layer 
 050d9f8c3b1c Pulling fs layer 
 710e142705f8 Pulling fs layer 
 cb628c265f09 Pulling fs layer 
 91d2729fa4d5 Waiting 
 9739ced65621 Waiting 
 ae3bb1b347a4 Waiting 
 f8406d9c00ea Waiting 
 c199bff16b05 Waiting 
 e0d55fdb4d15 Waiting 
 c1cb13b19080 Waiting 
 873532e5f8c7 Waiting 
 050d9f8c3b1c Waiting 
 710e142705f8 Waiting 
 cb628c265f09 Waiting 
 f9dd052e142d Pulling fs layer 
 e8c6d4883897 Pulling fs layer 
 648eb81b3252 Pulling fs layer 
 eb77aa907276 Pulling fs layer 
 4f4fb700ef54 Pulling fs layer 
 0ffa8f8aba1e Pulling fs layer 
 2e81b9cb93cd Pulling fs layer 
 f9dd052e142d Waiting 
 648eb81b3252 Waiting 
 e8c6d4883897 Waiting 
 eb77aa907276 Waiting 
 4f4fb700ef54 Waiting 
 0ffa8f8aba1e Waiting 
 2e81b9cb93cd Waiting 
 dda3d8fbd5ed Downloading [========================================>          ]     934B/1.165kB
 dda3d8fbd5ed Download complete 
 283a477db7bb Downloading [>                                                  ]  46.52kB/4.533MB
 b0a0cf830b12 Downloading [>                                                  ]  300.1kB/29.15MB
 283a477db7bb Downloading [=================================>                 ]  3.064MB/4.533MB
 b0a0cf830b12 Downloading [====>                                              ]  2.678MB/29.15MB
 283a477db7bb Verifying Checksum 
 283a477db7bb Download complete 
 91d2729fa4d5 Downloading [>                                                  ]  14.62kB/1.45MB
 b0a0cf830b12 Downloading [=======>                                           ]  4.473MB/29.15MB
 91d2729fa4d5 Downloading [==================================================>]   1.45MB/1.45MB
 91d2729fa4d5 Verifying Checksum 
 91d2729fa4d5 Download complete 
 b0a0cf830b12 Downloading [==============>                                    ]  8.671MB/29.15MB
 b0a0cf830b12 Downloading [==================>                                ]  10.76MB/29.15MB
 9739ced65621 Downloading [>                                                  ]  84.39kB/8.069MB
 9739ced65621 Downloading [===========================>                       ]  4.432MB/8.069MB
 ae3bb1b347a4 Downloading [>                                                  ]  13.25kB/1.196MB
 b0a0cf830b12 Downloading [=============================>                     ]  17.06MB/29.15MB
 9739ced65621 Verifying Checksum 
 9739ced65621 Download complete 
 ae3bb1b347a4 Verifying Checksum 
 ae3bb1b347a4 Download complete 
 b0a0cf830b12 Downloading [================================>                  ]  19.14MB/29.15MB
 b0a0cf830b12 Downloading [=============================================>     ]  26.37MB/29.15MB
 c199bff16b05 Downloading [==============>                                    ]     933B/3.145kB
 c199bff16b05 Downloading [==================================================>]  3.145kB/3.145kB
 c199bff16b05 Verifying Checksum 
 c199bff16b05 Download complete 
 f8406d9c00ea Downloading [==================================================>]     116B/116B
 f8406d9c00ea Verifying Checksum 
 f8406d9c00ea Download complete 
 b0a0cf830b12 Downloading [=================================================> ]   29.1MB/29.15MB
 b0a0cf830b12 Download complete 
 b0a0cf830b12 Extracting [>                                                  ]  294.9kB/29.15MB
 b0a0cf830b12 Extracting [=========>                                         ]  5.308MB/29.15MB
 c1cb13b19080 Downloading [====>                                              ]     933B/9.925kB
 c1cb13b19080 Downloading [==================================================>]  9.925kB/9.925kB
 c1cb13b19080 Verifying Checksum 
 c1cb13b19080 Download complete 
 873532e5f8c7 Downloading [==================================================>]     128B/128B
 873532e5f8c7 Download complete 
 e0d55fdb4d15 Downloading [>                                                  ]  525.5kB/109MB
 b0a0cf830b12 Extracting [================>                                  ]  9.732MB/29.15MB
 b0a0cf830b12 Extracting [===================>                               ]   11.5MB/29.15MB
 e0d55fdb4d15 Downloading [=>                                                 ]  4.242MB/109MB
 050d9f8c3b1c Downloading [==================================================>]     169B/169B
 050d9f8c3b1c Download complete 
 b0a0cf830b12 Extracting [===============================>                   ]  18.58MB/29.15MB
 e0d55fdb4d15 Downloading [===>                                               ]  6.907MB/109MB
 710e142705f8 Downloading [========>                                          ]     933B/5.421kB
 710e142705f8 Downloading [==================================================>]  5.421kB/5.421kB
 710e142705f8 Verifying Checksum 
 710e142705f8 Download complete 
 b0a0cf830b12 Extracting [=========================================>         ]  24.48MB/29.15MB
 e0d55fdb4d15 Downloading [====>                                              ]  9.037MB/109MB
 cb628c265f09 Downloading [==================================================>]     184B/184B
 cb628c265f09 Verifying Checksum 
 cb628c265f09 Download complete 
 e0d55fdb4d15 Downloading [=====>                                             ]  12.22MB/109MB
 f9dd052e142d Downloading [>                                                  ]    536kB/52.33MB
 e0d55fdb4d15 Downloading [=====>                                             ]  12.76MB/109MB
 f9dd052e142d Downloading [========>                                          ]  8.498MB/52.33MB
 e0d55fdb4d15 Downloading [======>                                            ]  14.88MB/109MB
 e8c6d4883897 Downloading [>                                                  ]  44.74kB/4.398MB
 f9dd052e142d Downloading [================>                                  ]  16.98MB/52.33MB
 b0a0cf830b12 Extracting [==========================================>        ]  24.77MB/29.15MB
 e8c6d4883897 Downloading [======================================>            ]  3.417MB/4.398MB
 e8c6d4883897 Downloading [==================================================>]  4.398MB/4.398MB
 e0d55fdb4d15 Downloading [========>                                          ]  18.09MB/109MB
 f9dd052e142d Downloading [======================>                            ]  23.84MB/52.33MB
 b0a0cf830b12 Extracting [===============================================>   ]  27.72MB/29.15MB
 e0d55fdb4d15 Downloading [=========>                                         ]  21.28MB/109MB
 f9dd052e142d Downloading [=====================================>             ]  38.72MB/52.33MB
 e0d55fdb4d15 Downloading [==========>                                        ]  23.39MB/109MB
 648eb81b3252 Downloading [=============================>                     ]     933B/1.561kB
 648eb81b3252 Downloading [==================================================>]  1.561kB/1.561kB
 648eb81b3252 Verifying Checksum 
 648eb81b3252 Download complete 
 f9dd052e142d Downloading [=================================================> ]  51.44MB/52.33MB
 f9dd052e142d Verifying Checksum 
 f9dd052e142d Download complete 
 f9dd052e142d Extracting [>                                                  ]  524.3kB/52.33MB
 e0d55fdb4d15 Downloading [============>                                      ]  28.18MB/109MB
 f9dd052e142d Extracting [=>                                                 ]  1.049MB/52.33MB
 e0d55fdb4d15 Downloading [==============>                                    ]  31.39MB/109MB
 b0a0cf830b12 Extracting [================================================>  ]  28.31MB/29.15MB
 e0d55fdb4d15 Downloading [================>                                  ]  35.15MB/109MB
 4f4fb700ef54 Downloading [==================================================>]      32B/32B
 4f4fb700ef54 Verifying Checksum 
 4f4fb700ef54 Download complete 
 eb77aa907276 Downloading [>                                                  ]    539kB/907.7MB
 b0a0cf830b12 Extracting [==================================================>]  29.15MB/29.15MB
 f9dd052e142d Extracting [====>                                              ]  4.719MB/52.33MB
 b0a0cf830b12 Pull complete 
 dda3d8fbd5ed Extracting [==================================================>]  1.165kB/1.165kB
 dda3d8fbd5ed Extracting [==================================================>]  1.165kB/1.165kB
 e0d55fdb4d15 Downloading [=================>                                 ]  38.89MB/109MB
 eb77aa907276 Downloading [>                                                  ]  6.957MB/907.7MB
 f9dd052e142d Extracting [=====>                                             ]  5.243MB/52.33MB
 e0d55fdb4d15 Downloading [===================>                               ]  41.55MB/109MB
 eb77aa907276 Downloading [>                                                  ]   9.62MB/907.7MB
 0ffa8f8aba1e Downloading [==================================================>]     226B/226B
 0ffa8f8aba1e Verifying Checksum 
 0ffa8f8aba1e Download complete 
 f9dd052e142d Extracting [===========>                                       ]  11.53MB/52.33MB
 e0d55fdb4d15 Downloading [====================>                              ]  45.28MB/109MB
 eb77aa907276 Downloading [>                                                  ]  14.46MB/907.7MB
 e0d55fdb4d15 Downloading [=====================>                             ]  46.34MB/109MB
 eb77aa907276 Downloading [>                                                  ]  15.52MB/907.7MB
 f9dd052e142d Extracting [=================>                                 ]  17.83MB/52.33MB
 2e81b9cb93cd Downloading [=========================>                         ]     933B/1.859kB
 2e81b9cb93cd Downloading [==================================================>]  1.859kB/1.859kB
 2e81b9cb93cd Verifying Checksum 
 2e81b9cb93cd Download complete 
 e0d55fdb4d15 Downloading [=======================>                           ]  51.12MB/109MB
 f9dd052e142d Extracting [========================>                          ]  25.69MB/52.33MB
 eb77aa907276 Downloading [=>                                                 ]  27.79MB/907.7MB
 e0d55fdb4d15 Downloading [=========================>                         ]  55.92MB/109MB
 f9dd052e142d Extracting [===========================>                       ]  28.31MB/52.33MB
 eb77aa907276 Downloading [=>                                                 ]  32.07MB/907.7MB
 f9dd052e142d Extracting [============================>                      ]  29.88MB/52.33MB
 e0d55fdb4d15 Downloading [==========================>                        ]  58.58MB/109MB
 eb77aa907276 Downloading [==>                                                ]  40.06MB/907.7MB
 f9dd052e142d Extracting [=============================>                     ]  30.93MB/52.33MB
 eb77aa907276 Downloading [==>                                                ]  48.58MB/907.7MB
 e0d55fdb4d15 Downloading [============================>                      ]  61.24MB/109MB
 f9dd052e142d Extracting [===============================>                   ]  33.03MB/52.33MB
 e0d55fdb4d15 Downloading [=============================>                     ]  63.36MB/109MB
 eb77aa907276 Downloading [==>                                                ]  54.42MB/907.7MB
 f9dd052e142d Extracting [==================================>                ]  35.65MB/52.33MB
 eb77aa907276 Downloading [===>                                               ]  65.06MB/907.7MB
 e0d55fdb4d15 Downloading [===============================>                   ]  69.24MB/109MB
 eb77aa907276 Downloading [====>                                              ]  74.09MB/907.7MB
 f9dd052e142d Extracting [====================================>              ]  37.75MB/52.33MB
 e0d55fdb4d15 Downloading [=================================>                 ]  72.45MB/109MB
 eb77aa907276 Downloading [====>                                              ]  81.55MB/907.7MB
 f9dd052e142d Extracting [======================================>            ]  40.37MB/52.33MB
 e0d55fdb4d15 Downloading [===================================>               ]  77.26MB/109MB
 eb77aa907276 Downloading [====>                                              ]  90.63MB/907.7MB
 f9dd052e142d Extracting [=========================================>         ]  43.52MB/52.33MB
 e0d55fdb4d15 Downloading [======================================>            ]  84.21MB/109MB
 eb77aa907276 Downloading [=====>                                             ]  95.43MB/907.7MB
 f9dd052e142d Extracting [=============================================>     ]  47.19MB/52.33MB
 e0d55fdb4d15 Downloading [=======================================>           ]  86.33MB/109MB
 eb77aa907276 Downloading [=====>                                             ]  98.61MB/907.7MB
 e0d55fdb4d15 Downloading [=======================================>           ]  86.87MB/109MB
 eb77aa907276 Downloading [=====>                                             ]  101.8MB/907.7MB
 e0d55fdb4d15 Downloading [=========================================>         ]  89.53MB/109MB
 eb77aa907276 Downloading [=====>                                             ]  103.9MB/907.7MB
 f9dd052e142d Extracting [=================================================> ]  51.38MB/52.33MB
 eb77aa907276 Downloading [=====>                                             ]  107.1MB/907.7MB
 e0d55fdb4d15 Downloading [==========================================>        ]  92.73MB/109MB
 f9dd052e142d Extracting [=================================================> ]   51.9MB/52.33MB
 f9dd052e142d Extracting [==================================================>]  52.33MB/52.33MB
 f9dd052e142d Pull complete 
 e8c6d4883897 Extracting [>                                                  ]  65.54kB/4.398MB
 dda3d8fbd5ed Pull complete 
 283a477db7bb Extracting [>                                                  ]  65.54kB/4.533MB
 e0d55fdb4d15 Downloading [============================================>      ]  96.45MB/109MB
 eb77aa907276 Downloading [======>                                            ]  111.9MB/907.7MB
 e8c6d4883897 Extracting [=====================>                             ]  1.901MB/4.398MB
 283a477db7bb Extracting [==================================================>]  4.533MB/4.533MB
 e0d55fdb4d15 Downloading [=============================================>     ]  99.66MB/109MB
 eb77aa907276 Downloading [======>                                            ]  117.3MB/907.7MB
 e8c6d4883897 Extracting [===================================>               ]  3.146MB/4.398MB
 e0d55fdb4d15 Downloading [===============================================>   ]  103.9MB/109MB
 eb77aa907276 Downloading [======>                                            ]  122.6MB/907.7MB
 eb77aa907276 Downloading [======>                                            ]  123.1MB/907.7MB
 e0d55fdb4d15 Downloading [===============================================>   ]  104.5MB/109MB
 e8c6d4883897 Extracting [=======================================>           ]  3.473MB/4.398MB
 eb77aa907276 Downloading [=======>                                           ]  132.2MB/907.7MB
 e0d55fdb4d15 Downloading [=================================================> ]  108.7MB/109MB
 e0d55fdb4d15 Verifying Checksum 
 e0d55fdb4d15 Download complete 
 e8c6d4883897 Extracting [=========================================>         ]   3.67MB/4.398MB
 e8c6d4883897 Extracting [==================================================>]  4.398MB/4.398MB
 e8c6d4883897 Pull complete 
 283a477db7bb Pull complete 
 648eb81b3252 Extracting [==================================================>]  1.561kB/1.561kB
 648eb81b3252 Extracting [==================================================>]  1.561kB/1.561kB
 91d2729fa4d5 Extracting [=>                                                 ]  32.77kB/1.45MB
 648eb81b3252 Pull complete 
 91d2729fa4d5 Extracting [==================================================>]   1.45MB/1.45MB
 91d2729fa4d5 Pull complete 
 9739ced65621 Extracting [>                                                  ]   98.3kB/8.069MB
 9739ced65621 Extracting [========================>                          ]  3.932MB/8.069MB
 eb77aa907276 Downloading [=======>                                           ]  137.5MB/907.7MB
 9739ced65621 Extracting [=====================================>             ]  5.997MB/8.069MB
 eb77aa907276 Downloading [========>                                          ]  147.1MB/907.7MB
 9739ced65621 Extracting [==================================================>]  8.069MB/8.069MB
 9739ced65621 Pull complete 
 ae3bb1b347a4 Extracting [=>                                                 ]  32.77kB/1.196MB
 eb77aa907276 Downloading [========>                                          ]  157.2MB/907.7MB
 ae3bb1b347a4 Extracting [==================================================>]  1.196MB/1.196MB
 ae3bb1b347a4 Extracting [==================================================>]  1.196MB/1.196MB
 ae3bb1b347a4 Pull complete 
 f8406d9c00ea Extracting [==================================================>]     116B/116B
 f8406d9c00ea Extracting [==================================================>]     116B/116B
 f8406d9c00ea Pull complete 
 c199bff16b05 Extracting [==================================================>]  3.145kB/3.145kB
 c199bff16b05 Extracting [==================================================>]  3.145kB/3.145kB
 c199bff16b05 Pull complete 
 eb77aa907276 Downloading [========>                                          ]  162.6MB/907.7MB
 e0d55fdb4d15 Extracting [>                                                  ]  557.1kB/109MB
 eb77aa907276 Downloading [=========>                                         ]  168.4MB/907.7MB
 e0d55fdb4d15 Extracting [===>                                               ]  7.799MB/109MB
 eb77aa907276 Downloading [=========>                                         ]  173.8MB/907.7MB
 e0d55fdb4d15 Extracting [=====>                                             ]   11.7MB/109MB
 eb77aa907276 Downloading [=========>                                         ]  180.7MB/907.7MB
 e0d55fdb4d15 Extracting [=======>                                           ]  16.71MB/109MB
 eb77aa907276 Downloading [==========>                                        ]  185.5MB/907.7MB
 e0d55fdb4d15 Extracting [========>                                          ]  18.38MB/109MB
 eb77aa907276 Downloading [==========>                                        ]  190.3MB/907.7MB
 e0d55fdb4d15 Extracting [==========>                                        ]  23.95MB/109MB
 e0d55fdb4d15 Extracting [==============>                                    ]  31.75MB/109MB
 eb77aa907276 Downloading [==========>                                        ]  195.1MB/907.7MB
 e0d55fdb4d15 Extracting [==================>                                ]  40.67MB/109MB
 eb77aa907276 Downloading [==========>                                        ]  198.8MB/907.7MB
 e0d55fdb4d15 Extracting [=======================>                           ]  50.14MB/109MB
 eb77aa907276 Downloading [==========>                                        ]  199.4MB/907.7MB
 e0d55fdb4d15 Extracting [=========================>                         ]  54.59MB/109MB
 eb77aa907276 Downloading [===========>                                       ]  204.7MB/907.7MB
 e0d55fdb4d15 Extracting [===========================>                       ]  60.72MB/109MB
 eb77aa907276 Downloading [===========>                                       ]    210MB/907.7MB
 e0d55fdb4d15 Extracting [================================>                  ]   71.3MB/109MB
 eb77aa907276 Downloading [===========>                                       ]  214.3MB/907.7MB
 e0d55fdb4d15 Extracting [====================================>              ]  79.66MB/109MB
 eb77aa907276 Downloading [============>                                      ]  219.1MB/907.7MB
 e0d55fdb4d15 Extracting [========================================>          ]  89.13MB/109MB
 eb77aa907276 Downloading [============>                                      ]  223.3MB/907.7MB
 e0d55fdb4d15 Extracting [==========================================>        ]  93.03MB/109MB
 eb77aa907276 Downloading [============>                                      ]  230.8MB/907.7MB
 e0d55fdb4d15 Extracting [============================================>      ]  96.93MB/109MB
 eb77aa907276 Downloading [============>                                      ]    235MB/907.7MB
 e0d55fdb4d15 Extracting [==============================================>    ]  100.3MB/109MB
 eb77aa907276 Downloading [=============>                                     ]    242MB/907.7MB
 e0d55fdb4d15 Extracting [===============================================>   ]  103.6MB/109MB
 eb77aa907276 Downloading [=============>                                     ]  248.9MB/907.7MB
 e0d55fdb4d15 Extracting [================================================>  ]  105.3MB/109MB
 eb77aa907276 Downloading [==============>                                    ]  258.5MB/907.7MB
 eb77aa907276 Downloading [==============>                                    ]  265.4MB/907.7MB
 eb77aa907276 Downloading [==============>                                    ]  271.3MB/907.7MB
 e0d55fdb4d15 Extracting [=================================================> ]  107.5MB/109MB
 eb77aa907276 Downloading [===============>                                   ]    275MB/907.7MB
 e0d55fdb4d15 Extracting [==================================================>]    109MB/109MB
 eb77aa907276 Downloading [===============>                                   ]  280.4MB/907.7MB
 eb77aa907276 Downloading [===============>                                   ]  284.1MB/907.7MB
 eb77aa907276 Downloading [===============>                                   ]  284.6MB/907.7MB
 eb77aa907276 Downloading [================>                                  ]  293.2MB/907.7MB
 eb77aa907276 Downloading [================>                                  ]  297.4MB/907.7MB
 eb77aa907276 Downloading [================>                                  ]  301.7MB/907.7MB
 e0d55fdb4d15 Pull complete 
 c1cb13b19080 Extracting [==================================================>]  9.925kB/9.925kB
 c1cb13b19080 Extracting [==================================================>]  9.925kB/9.925kB
 eb77aa907276 Downloading [================>                                  ]  302.8MB/907.7MB
 c1cb13b19080 Pull complete 
 873532e5f8c7 Extracting [==================================================>]     128B/128B
 873532e5f8c7 Extracting [==================================================>]     128B/128B
 873532e5f8c7 Pull complete 
 050d9f8c3b1c Extracting [==================================================>]     169B/169B
 050d9f8c3b1c Extracting [==================================================>]     169B/169B
 050d9f8c3b1c Pull complete 
 710e142705f8 Extracting [==================================================>]  5.421kB/5.421kB
 710e142705f8 Extracting [==================================================>]  5.421kB/5.421kB
 710e142705f8 Pull complete 
 cb628c265f09 Extracting [==================================================>]     184B/184B
 cb628c265f09 Extracting [==================================================>]     184B/184B
 cb628c265f09 Pull complete 
 postgresql Pulled 
 eb77aa907276 Downloading [================>                                  ]    306MB/907.7MB
 eb77aa907276 Downloading [================>                                  ]  307.6MB/907.7MB
 eb77aa907276 Downloading [=================>                                 ]  311.3MB/907.7MB
 eb77aa907276 Downloading [=================>                                 ]  315.6MB/907.7MB
 eb77aa907276 Downloading [=================>                                 ]  320.9MB/907.7MB
 eb77aa907276 Downloading [==================>                                ]    331MB/907.7MB
 eb77aa907276 Downloading [==================>                                ]  341.7MB/907.7MB
 eb77aa907276 Downloading [===================>                               ]  348.6MB/907.7MB
 eb77aa907276 Downloading [===================>                               ]    355MB/907.7MB
 eb77aa907276 Downloading [====================>                              ]  363.5MB/907.7MB
 eb77aa907276 Downloading [====================>                              ]  369.4MB/907.7MB
 eb77aa907276 Downloading [====================>                              ]  376.8MB/907.7MB
 eb77aa907276 Downloading [=====================>                             ]  383.2MB/907.7MB
 eb77aa907276 Downloading [=====================>                             ]  390.2MB/907.7MB
 eb77aa907276 Downloading [=====================>                             ]  398.2MB/907.7MB
 eb77aa907276 Downloading [======================>                            ]  406.7MB/907.7MB
 eb77aa907276 Downloading [======================>                            ]  416.3MB/907.7MB
 eb77aa907276 Downloading [=======================>                           ]  423.8MB/907.7MB
 eb77aa907276 Downloading [=======================>                           ]  428.6MB/907.7MB
 eb77aa907276 Downloading [========================>                          ]  436.6MB/907.7MB
 eb77aa907276 Downloading [========================>                          ]  443.5MB/907.7MB
 eb77aa907276 Downloading [========================>                          ]  450.4MB/907.7MB
 eb77aa907276 Downloading [=========================>                         ]  458.9MB/907.7MB
 eb77aa907276 Downloading [=========================>                         ]  467.5MB/907.7MB
 eb77aa907276 Downloading [==========================>                        ]    476MB/907.7MB
 eb77aa907276 Downloading [==========================>                        ]  482.4MB/907.7MB
 eb77aa907276 Downloading [==========================>                        ]  489.9MB/907.7MB
 eb77aa907276 Downloading [===========================>                       ]  501.6MB/907.7MB
 eb77aa907276 Downloading [===========================>                       ]    508MB/907.7MB
 eb77aa907276 Downloading [============================>                      ]  518.1MB/907.7MB
 eb77aa907276 Downloading [=============================>                     ]  529.4MB/907.7MB
 eb77aa907276 Downloading [=============================>                     ]  533.1MB/907.7MB
 eb77aa907276 Downloading [=============================>                     ]  536.8MB/907.7MB
 eb77aa907276 Downloading [=============================>                     ]  541.6MB/907.7MB
 eb77aa907276 Downloading [==============================>                    ]  548.5MB/907.7MB
 eb77aa907276 Downloading [==============================>                    ]  562.4MB/907.7MB
 eb77aa907276 Downloading [===============================>                   ]  571.4MB/907.7MB
 eb77aa907276 Downloading [================================>                  ]  581.5MB/907.7MB
 eb77aa907276 Downloading [================================>                  ]  583.6MB/907.7MB
 eb77aa907276 Downloading [================================>                  ]  589.5MB/907.7MB
 eb77aa907276 Downloading [================================>                  ]  595.9MB/907.7MB
 eb77aa907276 Downloading [=================================>                 ]  599.6MB/907.7MB
 eb77aa907276 Downloading [=================================>                 ]  602.3MB/907.7MB
 eb77aa907276 Downloading [=================================>                 ]  609.8MB/907.7MB
 eb77aa907276 Downloading [=================================>                 ]    613MB/907.7MB
 eb77aa907276 Downloading [==================================>                ]  618.8MB/907.7MB
 eb77aa907276 Downloading [==================================>                ]  624.7MB/907.7MB
 eb77aa907276 Downloading [==================================>                ]  632.7MB/907.7MB
 eb77aa907276 Downloading [===================================>               ]  640.2MB/907.7MB
 eb77aa907276 Downloading [===================================>               ]  651.4MB/907.7MB
 eb77aa907276 Downloading [====================================>              ]  654.6MB/907.7MB
 eb77aa907276 Downloading [====================================>              ]  659.4MB/907.7MB
 eb77aa907276 Downloading [====================================>              ]  666.9MB/907.7MB
 eb77aa907276 Downloading [====================================>              ]  670.1MB/907.7MB
 eb77aa907276 Downloading [=====================================>             ]  672.2MB/907.7MB
 eb77aa907276 Downloading [=====================================>             ]  675.9MB/907.7MB
 eb77aa907276 Downloading [=====================================>             ]  679.1MB/907.7MB
 eb77aa907276 Downloading [=====================================>             ]  683.9MB/907.7MB
 eb77aa907276 Downloading [=====================================>             ]  687.1MB/907.7MB
 eb77aa907276 Downloading [======================================>            ]  691.9MB/907.7MB
 eb77aa907276 Downloading [======================================>            ]  698.3MB/907.7MB
 eb77aa907276 Downloading [======================================>            ]    701MB/907.7MB
 eb77aa907276 Downloading [======================================>            ]  704.7MB/907.7MB
 eb77aa907276 Downloading [=======================================>           ]  708.4MB/907.7MB
 eb77aa907276 Downloading [=======================================>           ]  712.2MB/907.7MB
 eb77aa907276 Downloading [=======================================>           ]  721.2MB/907.7MB
 eb77aa907276 Downloading [=======================================>           ]  724.9MB/907.7MB
 eb77aa907276 Downloading [========================================>          ]  728.7MB/907.7MB
 eb77aa907276 Downloading [========================================>          ]  739.3MB/907.7MB
 eb77aa907276 Downloading [=========================================>         ]  744.6MB/907.7MB
 eb77aa907276 Downloading [=========================================>         ]  756.3MB/907.7MB
 eb77aa907276 Downloading [==========================================>        ]  765.4MB/907.7MB
 eb77aa907276 Downloading [==========================================>        ]  775.6MB/907.7MB
 eb77aa907276 Downloading [===========================================>       ]  785.7MB/907.7MB
 eb77aa907276 Downloading [===========================================>       ]  792.6MB/907.7MB
 eb77aa907276 Downloading [============================================>      ]  804.3MB/907.7MB
 eb77aa907276 Downloading [============================================>      ]  811.8MB/907.7MB
 eb77aa907276 Downloading [============================================>      ]  814.5MB/907.7MB
 eb77aa907276 Downloading [=============================================>     ]  818.7MB/907.7MB
 eb77aa907276 Downloading [=============================================>     ]  822.9MB/907.7MB
 eb77aa907276 Downloading [=============================================>     ]  829.3MB/907.7MB
 eb77aa907276 Downloading [=============================================>     ]  833.1MB/907.7MB
 eb77aa907276 Downloading [==============================================>    ]  837.4MB/907.7MB
 eb77aa907276 Downloading [==============================================>    ]    840MB/907.7MB
 eb77aa907276 Downloading [==============================================>    ]  842.2MB/907.7MB
 eb77aa907276 Downloading [==============================================>    ]  845.4MB/907.7MB
 eb77aa907276 Downloading [==============================================>    ]    847MB/907.7MB
 eb77aa907276 Downloading [==============================================>    ]  849.1MB/907.7MB
 eb77aa907276 Downloading [===============================================>   ]  855.5MB/907.7MB
 eb77aa907276 Downloading [===============================================>   ]  858.7MB/907.7MB
 eb77aa907276 Downloading [===============================================>   ]  859.3MB/907.7MB
 eb77aa907276 Downloading [===============================================>   ]  863.5MB/907.7MB
 eb77aa907276 Downloading [===============================================>   ]  867.3MB/907.7MB
 eb77aa907276 Downloading [===============================================>   ]  868.9MB/907.7MB
 eb77aa907276 Downloading [===============================================>   ]    871MB/907.7MB
 eb77aa907276 Downloading [================================================>  ]  872.6MB/907.7MB
 eb77aa907276 Downloading [================================================>  ]  874.7MB/907.7MB
 eb77aa907276 Downloading [================================================>  ]  876.9MB/907.7MB
 eb77aa907276 Downloading [================================================>  ]  878.5MB/907.7MB
 eb77aa907276 Downloading [================================================>  ]  881.6MB/907.7MB
 eb77aa907276 Downloading [================================================>  ]  885.9MB/907.7MB
 eb77aa907276 Downloading [=================================================> ]  889.6MB/907.7MB
 eb77aa907276 Downloading [=================================================> ]  898.7MB/907.7MB
 eb77aa907276 Downloading [=================================================> ]  903.5MB/907.7MB
 eb77aa907276 Verifying Checksum 
 eb77aa907276 Download complete 
 eb77aa907276 Extracting [>                                                  ]  557.1kB/907.7MB
 eb77aa907276 Extracting [=>                                                 ]  25.07MB/907.7MB
 eb77aa907276 Extracting [==>                                                ]  48.46MB/907.7MB
 eb77aa907276 Extracting [====>                                              ]  72.97MB/907.7MB
 eb77aa907276 Extracting [====>                                              ]  85.23MB/907.7MB
 eb77aa907276 Extracting [=====>                                             ]  95.81MB/907.7MB
 eb77aa907276 Extracting [=====>                                             ]  105.3MB/907.7MB
 eb77aa907276 Extracting [======>                                            ]  114.8MB/907.7MB
 eb77aa907276 Extracting [======>                                            ]  123.7MB/907.7MB
 eb77aa907276 Extracting [=======>                                           ]  132.6MB/907.7MB
 eb77aa907276 Extracting [=======>                                           ]  140.9MB/907.7MB
 eb77aa907276 Extracting [========>                                          ]  148.2MB/907.7MB
 eb77aa907276 Extracting [========>                                          ]  157.1MB/907.7MB
 eb77aa907276 Extracting [=========>                                         ]  174.4MB/907.7MB
 eb77aa907276 Extracting [==========>                                        ]  195.5MB/907.7MB
 eb77aa907276 Extracting [===========>                                       ]  212.8MB/907.7MB
 eb77aa907276 Extracting [============>                                      ]  224.5MB/907.7MB
 eb77aa907276 Extracting [============>                                      ]  234.5MB/907.7MB
 eb77aa907276 Extracting [=============>                                     ]  245.7MB/907.7MB
 eb77aa907276 Extracting [==============>                                    ]  264.6MB/907.7MB
 eb77aa907276 Extracting [===============>                                   ]  286.9MB/907.7MB
 eb77aa907276 Extracting [=================>                                 ]  310.8MB/907.7MB
 eb77aa907276 Extracting [==================>                                ]  332.6MB/907.7MB
 eb77aa907276 Extracting [===================>                               ]  354.3MB/907.7MB
 eb77aa907276 Extracting [====================>                              ]  364.9MB/907.7MB
 eb77aa907276 Extracting [====================>                              ]  372.7MB/907.7MB
 eb77aa907276 Extracting [=====================>                             ]  391.6MB/907.7MB
 eb77aa907276 Extracting [======================>                            ]  414.4MB/907.7MB
 eb77aa907276 Extracting [========================>                          ]  442.3MB/907.7MB
 eb77aa907276 Extracting [=========================>                         ]  470.2MB/907.7MB
 eb77aa907276 Extracting [===========================>                       ]  499.7MB/907.7MB
 eb77aa907276 Extracting [=============================>                     ]  529.2MB/907.7MB
 eb77aa907276 Extracting [==============================>                    ]  558.7MB/907.7MB
 eb77aa907276 Extracting [================================>                  ]  586.6MB/907.7MB
 eb77aa907276 Extracting [=================================>                 ]  613.9MB/907.7MB
 eb77aa907276 Extracting [===================================>               ]  642.8MB/907.7MB
 eb77aa907276 Extracting [=====================================>             ]  671.8MB/907.7MB
 eb77aa907276 Extracting [======================================>            ]  700.2MB/907.7MB
 eb77aa907276 Extracting [=======================================>           ]  723.6MB/907.7MB
 eb77aa907276 Extracting [=========================================>         ]  748.1MB/907.7MB
 eb77aa907276 Extracting [==========================================>        ]    771MB/907.7MB
 eb77aa907276 Extracting [===========================================>       ]  792.7MB/907.7MB
 eb77aa907276 Extracting [============================================>      ]    815MB/907.7MB
 eb77aa907276 Extracting [==============================================>    ]  836.1MB/907.7MB
 eb77aa907276 Extracting [===============================================>   ]  856.2MB/907.7MB
 eb77aa907276 Extracting [================================================>  ]  877.4MB/907.7MB
 eb77aa907276 Extracting [=================================================> ]  900.2MB/907.7MB
 eb77aa907276 Extracting [==================================================>]  907.7MB/907.7MB
 eb77aa907276 Pull complete 
 4f4fb700ef54 Extracting [==================================================>]      32B/32B
 4f4fb700ef54 Extracting [==================================================>]      32B/32B
 4f4fb700ef54 Pull complete 
 0ffa8f8aba1e Extracting [==================================================>]     226B/226B
 0ffa8f8aba1e Extracting [==================================================>]     226B/226B
 0ffa8f8aba1e Pull complete 
 2e81b9cb93cd Extracting [==================================================>]  1.859kB/1.859kB
 2e81b9cb93cd Extracting [==================================================>]  1.859kB/1.859kB
 2e81b9cb93cd Pull complete 
 opensearch Pulled 
 Network docker_services_cli_default  Creating
 Network docker_services_cli_default  Created
 Container docker_services_cli-opensearch-1  Creating
 Container docker_services_cli-postgresql-1  Creating
 Container docker_services_cli-opensearch-1  Created
 Container docker_services_cli-postgresql-1  Created
 Container docker_services_cli-opensearch-1  Starting
 Container docker_services_cli-postgresql-1  Starting
 Container docker_services_cli-postgresql-1  Started
 Container docker_services_cli-opensearch-1  Started
============================= test session starts ==============================
platform linux -- Python 3.12.12, pytest-8.4.2, pluggy-1.6.0
rootdir: /home/runner/work/invenio-bug-verification/invenio-bug-verification/package-repo
configfile: setup.cfg
testpaths: docs, tests, invenio_search
plugins: github-actions-annotate-failures-0.3.0, pycodestyle-2.5.0, flask-1.3.0, black-ng-0.4.1, invenio-3.4.2, isort-4.0.0, cov-7.0.0, pydocstyle-2.4.0
collected 140 items

docs/conf.py ...                                                         [  2%]
tests/conftest.py ...                                                    [  4%]
tests/mock_module/__init__.py ...                                        [  6%]
tests/mock_module/component_templates/__init__.py ...                    [  8%]
tests/mock_module/component_templates/os-v2/__init__.py ...              [ 10%]
tests/mock_module/component_templates/v7/__init__.py ...                 [ 12%]
tests/mock_module/index_templates/__init__.py ...                        [ 15%]
tests/mock_module/index_templates/os-v2/__init__.py ...                  [ 17%]
tests/mock_module/index_templates/v7/__init__.py ...                     [ 19%]
tests/mock_module/mappings/__init__.py ...                               [ 21%]
tests/mock_module/mappings/os-v1/__init__.py ...                         [ 23%]
tests/mock_module/mappings/os-v2/__init__.py ...                         [ 25%]
tests/mock_module/mappings/v7/__init__.py ...                            [ 27%]
tests/mock_module/templates/__init__.py ...                              [ 30%]
tests/mock_module/templates/os-v1/__init__.py ...                        [ 32%]
tests/mock_module/templates/os-v2/__init__.py ...                        [ 34%]
tests/mock_module/templates/v7/__init__.py ...                           [ 36%]
tests/test_cli.py ....::error file=package-repo/tests/test_cli.py,line=155::test_check%0A%0Aassert 0 > 0%0A +  where 0 = <Result okay>.exit_code
F.                                                 [ 40%]
tests/test_invenio_search.py ................................            [ 63%]
tests/test_query.py .................                                    [ 75%]
tests/test_utils.py .......                                              [ 80%]
invenio_search/__init__.py ...                                           [ 82%]
invenio_search/api.py ...                                                [ 85%]
invenio_search/cli.py ...                                                [ 87%]
invenio_search/config.py ...                                             [ 89%]
invenio_search/engine.py ...                                             [ 91%]
invenio_search/errors.py ...                                             [ 93%]
invenio_search/ext.py ...                                                [ 95%]
invenio_search/proxies.py ...                                            [ 97%]
invenio_search/utils.py ...                                              [100%]

=================================== FAILURES ===================================
__________________________________ test_check __________________________________

app = <Flask 'testapp'>

    def test_check(app):
        runner = CliRunner()
        script_info = ScriptInfo(create_app=lambda: app)
    
        result = runner.invoke(cmd, ["check"], obj=script_info)
        assert result.exit_code == 0
    
        wrong_version = search.VERSION[0] + 1
        with patch(
            "invenio_search.cli.search.VERSION",
            return_value=(wrong_version, 0, 0),
        ):
            result = runner.invoke(cmd, ["check"], obj=script_info)
>           assert result.exit_code > 0
E           assert 0 > 0
E            +  where 0 = <Result okay>.exit_code

tests/test_cli.py:155: AssertionError
- generated xml file: /home/runner/work/invenio-bug-verification/invenio-bug-verification/artifacts/test-report-patched.xml -
================================ tests coverage ================================
_______________ coverage: platform linux, python 3.12.12-final-0 _______________

Name                         Stmts   Miss  Cover   Missing
----------------------------------------------------------
invenio_search/__init__.py       5      0   100%
invenio_search/api.py          129      8    94%   50, 54, 58, 62, 106, 114, 250, 258
invenio_search/cli.py          122      7    94%   27, 41, 60, 120-126, 184-185
invenio_search/config.py        12      0   100%
invenio_search/engine.py        33     16    52%   26-28, 34-37, 48, 65-71, 76, 81, 86-87
invenio_search/errors.py         2      0   100%
invenio_search/ext.py          275     13    95%   119, 127-136, 225, 344, 373, 443-444, 460, 532, 536, 546
invenio_search/proxies.py        8      0   100%
invenio_search/utils.py         23      0   100%
----------------------------------------------------------
TOTAL                          609     44    93%
=========================== short test summary info ============================
FAILED tests/test_cli.py::test_check - assert 0 > 0
 +  where 0 = <Result okay>.exit_code
======================== 1 failed, 139 passed in 12.65s ========================
 Container docker_services_cli-postgresql-1  Stopping
 Container docker_services_cli-opensearch-1  Stopping
 Container docker_services_cli-postgresql-1  Stopped
 Container docker_services_cli-postgresql-1  Removing
 Container docker_services_cli-postgresql-1  Removed
 Container docker_services_cli-opensearch-1  Stopped
 Container docker_services_cli-opensearch-1  Removing
 Container docker_services_cli-opensearch-1  Removed
 Network docker_services_cli_default  Removing
 Network docker_services_cli_default  Removed
