lists of files in version control and sdist match
 rabbitmq Pulling 
 redis Pulling 
 postgresql Pulling 
 opensearch Pulling 
 f9dd052e142d Pulling fs layer 
 e8c6d4883897 Pulling fs layer 
 648eb81b3252 Pulling fs layer 
 eb77aa907276 Pulling fs layer 
 4f4fb700ef54 Pulling fs layer 
 0ffa8f8aba1e Pulling fs layer 
 2e81b9cb93cd Pulling fs layer 
 4f4fb700ef54 Waiting 
 0ffa8f8aba1e Waiting 
 2e81b9cb93cd Waiting 
 eb77aa907276 Waiting 
 1adabd6b0d6b Pulling fs layer 
 a876f6225e72 Pulling fs layer 
 e06b5a47837d Pulling fs layer 
 306343d42fe6 Pulling fs layer 
 56a10b9d0fdd Pulling fs layer 
 fa42f65f0d3f Pulling fs layer 
 4f4fb700ef54 Pulling fs layer 
 9e749293ebb8 Pulling fs layer 
 306343d42fe6 Waiting 
 4f4fb700ef54 Waiting 
 56a10b9d0fdd Waiting 
 9e749293ebb8 Waiting 
 fa42f65f0d3f Waiting 
 1adabd6b0d6b Waiting 
 a876f6225e72 Waiting 
 e06b5a47837d Waiting 
 b0a0cf830b12 Pulling fs layer 
 dda3d8fbd5ed Pulling fs layer 
 283a477db7bb Pulling fs layer 
 91d2729fa4d5 Pulling fs layer 
 9739ced65621 Pulling fs layer 
 ae3bb1b347a4 Pulling fs layer 
 f8406d9c00ea Pulling fs layer 
 c199bff16b05 Pulling fs layer 
 e0d55fdb4d15 Pulling fs layer 
 c1cb13b19080 Pulling fs layer 
 873532e5f8c7 Pulling fs layer 
 050d9f8c3b1c Pulling fs layer 
 710e142705f8 Pulling fs layer 
 cb628c265f09 Pulling fs layer 
 dda3d8fbd5ed Waiting 
 283a477db7bb Waiting 
 91d2729fa4d5 Waiting 
 9739ced65621 Waiting 
 ae3bb1b347a4 Waiting 
 b0a0cf830b12 Waiting 
 f8406d9c00ea Waiting 
 050d9f8c3b1c Waiting 
 c199bff16b05 Waiting 
 e0d55fdb4d15 Waiting 
 710e142705f8 Waiting 
 cb628c265f09 Waiting 
 c1cb13b19080 Waiting 
 873532e5f8c7 Waiting 
 648eb81b3252 Downloading [=============================>                     ]     933B/1.561kB
 648eb81b3252 Download complete 
 f9dd052e142d Downloading [>                                                  ]  528.5kB/52.33MB
 e8c6d4883897 Downloading [>                                                  ]  45.19kB/4.398MB
 e8c6d4883897 Verifying Checksum 
 e8c6d4883897 Download complete 
 f9dd052e142d Downloading [===============>                                   ]  15.98MB/52.33MB
 20043066d3d5 Pulling fs layer 
 fbda4a386d13 Pulling fs layer 
 257b1af0856e Pulling fs layer 
 e5fbc57eeafe Pulling fs layer 
 f19b7ac6489f Pulling fs layer 
 0f9a1c409bb2 Pulling fs layer 
 d5d9860a5545 Pulling fs layer 
 fc030d7bf8ba Pulling fs layer 
 c5ec72a0a4d4 Pulling fs layer 
 a51622689fc8 Pulling fs layer 
 20043066d3d5 Waiting 
 fbda4a386d13 Waiting 
 257b1af0856e Waiting 
 e5fbc57eeafe Waiting 
 f19b7ac6489f Waiting 
 0f9a1c409bb2 Waiting 
 d5d9860a5545 Waiting 
 fc030d7bf8ba Waiting 
 c5ec72a0a4d4 Waiting 
 a51622689fc8 Waiting 
 f9dd052e142d Downloading [=============================>                     ]  30.81MB/52.33MB
 eb77aa907276 Downloading [>                                                  ]    536kB/907.7MB
 f9dd052e142d Downloading [============================================>      ]  46.22MB/52.33MB
 4f4fb700ef54 Downloading [==================================================>]      32B/32B
 4f4fb700ef54 Verifying Checksum 
 4f4fb700ef54 Download complete 
 eb77aa907276 Downloading [>                                                  ]  15.44MB/907.7MB
 f9dd052e142d Verifying Checksum 
 f9dd052e142d Download complete 
 f9dd052e142d Extracting [>                                                  ]  524.3kB/52.33MB
 eb77aa907276 Downloading [=>                                                 ]  34.66MB/907.7MB
 f9dd052e142d Extracting [=>                                                 ]  1.573MB/52.33MB
 eb77aa907276 Downloading [==>                                                ]  49.52MB/907.7MB
 0ffa8f8aba1e Downloading [==================================================>]     226B/226B
 0ffa8f8aba1e Verifying Checksum 
 0ffa8f8aba1e Download complete 
 2e81b9cb93cd Downloading [=========================>                         ]     933B/1.859kB
 2e81b9cb93cd Downloading [==================================================>]  1.859kB/1.859kB
 2e81b9cb93cd Verifying Checksum 
 2e81b9cb93cd Download complete 
 f9dd052e142d Extracting [====>                                              ]  4.719MB/52.33MB
 eb77aa907276 Downloading [===>                                               ]  71.96MB/907.7MB
 eb77aa907276 Downloading [=====>                                             ]  95.43MB/907.7MB
 f9dd052e142d Extracting [=====>                                             ]  5.767MB/52.33MB
 1adabd6b0d6b Downloading [>                                                  ]  284.1kB/28.23MB
 a876f6225e72 Downloading [==========================================>        ]     933B/1.099kB
 a876f6225e72 Downloading [==================================================>]  1.099kB/1.099kB
 a876f6225e72 Verifying Checksum 
 a876f6225e72 Download complete 
 eb77aa907276 Downloading [=====>                                             ]  107.2MB/907.7MB
 f9dd052e142d Extracting [============>                                      ]  12.58MB/52.33MB
 1adabd6b0d6b Downloading [===================================>               ]  20.21MB/28.23MB
 eb77aa907276 Downloading [=======>                                           ]  128.5MB/907.7MB
 1adabd6b0d6b Verifying Checksum 
 1adabd6b0d6b Download complete 
 f9dd052e142d Extracting [==================>                                ]   19.4MB/52.33MB
 1adabd6b0d6b Extracting [>                                                  ]  294.9kB/28.23MB
 eb77aa907276 Downloading [=======>                                           ]    137MB/907.7MB
 e06b5a47837d Downloading [==================================================>]     874B/874B
 e06b5a47837d Verifying Checksum 
 e06b5a47837d Download complete 
 f9dd052e142d Extracting [=========================>                         ]  26.21MB/52.33MB
 1adabd6b0d6b Extracting [=======>                                           ]  4.424MB/28.23MB
 eb77aa907276 Downloading [========>                                          ]  151.3MB/907.7MB
 f9dd052e142d Extracting [==========================>                        ]  27.79MB/52.33MB
 306343d42fe6 Downloading [>                                                  ]  14.62kB/1.438MB
 1adabd6b0d6b Extracting [===============>                                   ]  8.847MB/28.23MB
 306343d42fe6 Verifying Checksum 
 306343d42fe6 Download complete 
 eb77aa907276 Downloading [=========>                                         ]  164.7MB/907.7MB
 1adabd6b0d6b Extracting [==================>                                ]  10.62MB/28.23MB
 f9dd052e142d Extracting [============================>                      ]  29.36MB/52.33MB
 56a10b9d0fdd Downloading [>                                                  ]  155.8kB/15.35MB
 eb77aa907276 Downloading [=========>                                         ]  175.8MB/907.7MB
 1adabd6b0d6b Extracting [==========================>                        ]  15.04MB/28.23MB
 56a10b9d0fdd Downloading [==============================================>    ]  14.34MB/15.35MB
 56a10b9d0fdd Verifying Checksum 
 56a10b9d0fdd Download complete 
 fa42f65f0d3f Downloading [==================================================>]      97B/97B
 fa42f65f0d3f Download complete 
 1adabd6b0d6b Extracting [======================================>            ]  21.53MB/28.23MB
 eb77aa907276 Downloading [==========>                                        ]    186MB/907.7MB
 f9dd052e142d Extracting [=============================>                     ]  30.41MB/52.33MB
 eb77aa907276 Downloading [==========>                                        ]  198.8MB/907.7MB
 4f4fb700ef54 Downloading [==================================================>]      32B/32B
 4f4fb700ef54 Verifying Checksum 
 4f4fb700ef54 Download complete 
 f9dd052e142d Extracting [===============================>                   ]  33.03MB/52.33MB
 9e749293ebb8 Download complete 
 1adabd6b0d6b Extracting [==========================================>        ]  23.89MB/28.23MB
 eb77aa907276 Downloading [===========>                                       ]  208.4MB/907.7MB
 f9dd052e142d Extracting [=================================>                 ]   34.6MB/52.33MB
 eb77aa907276 Downloading [============>                                      ]  225.5MB/907.7MB
 1adabd6b0d6b Extracting [===============================================>   ]  26.84MB/28.23MB
 f9dd052e142d Extracting [===================================>               ]   36.7MB/52.33MB
 eb77aa907276 Downloading [============>                                      ]    235MB/907.7MB
 dda3d8fbd5ed Downloading [========================================>          ]     934B/1.165kB
 dda3d8fbd5ed Downloading [==================================================>]  1.165kB/1.165kB
 dda3d8fbd5ed Verifying Checksum 
 dda3d8fbd5ed Download complete 
 b0a0cf830b12 Downloading [>                                                  ]  306.6kB/29.15MB
 eb77aa907276 Downloading [=============>                                     ]  247.8MB/907.7MB
 f9dd052e142d Extracting [====================================>              ]  38.27MB/52.33MB
 b0a0cf830b12 Downloading [==========================================>        ]  24.85MB/29.15MB
 b0a0cf830b12 Download complete 
 eb77aa907276 Downloading [==============>                                    ]  265.9MB/907.7MB
 f9dd052e142d Extracting [======================================>            ]  40.37MB/52.33MB
 b0a0cf830b12 Extracting [>                                                  ]  294.9kB/29.15MB
 283a477db7bb Downloading [>                                                  ]  46.56kB/4.533MB
 283a477db7bb Downloading [==================================================>]  4.533MB/4.533MB
 eb77aa907276 Downloading [===============>                                   ]  277.6MB/907.7MB
 283a477db7bb Verifying Checksum 
 283a477db7bb Download complete 
 b0a0cf830b12 Extracting [======>                                            ]  3.539MB/29.15MB
 f9dd052e142d Extracting [========================================>          ]  42.47MB/52.33MB
 1adabd6b0d6b Extracting [================================================>  ]  27.43MB/28.23MB
 eb77aa907276 Downloading [================>                                  ]  290.5MB/907.7MB
 91d2729fa4d5 Downloading [>                                                  ]  14.62kB/1.45MB
 b0a0cf830b12 Extracting [============>                                      ]  7.373MB/29.15MB
 f9dd052e142d Extracting [==========================================>        ]  44.56MB/52.33MB
 91d2729fa4d5 Downloading [==================================================>]   1.45MB/1.45MB
 91d2729fa4d5 Verifying Checksum 
 91d2729fa4d5 Download complete 
 eb77aa907276 Downloading [================>                                  ]  303.3MB/907.7MB
 1adabd6b0d6b Extracting [==================================================>]  28.23MB/28.23MB
 f9dd052e142d Extracting [============================================>      ]  46.66MB/52.33MB
 b0a0cf830b12 Extracting [================>                                  ]  9.732MB/29.15MB
 1adabd6b0d6b Pull complete 
 a876f6225e72 Extracting [==================================================>]  1.099kB/1.099kB
 a876f6225e72 Extracting [==================================================>]  1.099kB/1.099kB
 9739ced65621 Downloading [>                                                  ]  81.92kB/8.069MB
 eb77aa907276 Downloading [=================>                                 ]  315.1MB/907.7MB
 9739ced65621 Verifying Checksum 
 9739ced65621 Download complete 
 b0a0cf830b12 Extracting [=================>                                 ]  10.32MB/29.15MB
 a876f6225e72 Pull complete 
 f9dd052e142d Extracting [=============================================>     ]  47.71MB/52.33MB
 eb77aa907276 Downloading [=================>                                 ]  326.3MB/907.7MB
 ae3bb1b347a4 Downloading [>                                                  ]  13.25kB/1.196MB
 ae3bb1b347a4 Verifying Checksum 
 ae3bb1b347a4 Download complete 
 f8406d9c00ea Downloading [==================================================>]     116B/116B
 f8406d9c00ea Verifying Checksum 
 f8406d9c00ea Download complete 
 eb77aa907276 Downloading [==================>                                ]  331.1MB/907.7MB
 b0a0cf830b12 Extracting [===================>                               ]   11.5MB/29.15MB
 eb77aa907276 Downloading [==================>                                ]  334.3MB/907.7MB
 f9dd052e142d Extracting [==============================================>    ]  48.23MB/52.33MB
 b0a0cf830b12 Extracting [====================>                              ]   11.8MB/29.15MB
 e06b5a47837d Extracting [==================================================>]     874B/874B
 e06b5a47837d Extracting [==================================================>]     874B/874B
 c199bff16b05 Downloading [==============>                                    ]     934B/3.145kB
 c199bff16b05 Downloading [==================================================>]  3.145kB/3.145kB
 c199bff16b05 Verifying Checksum 
 c199bff16b05 Download complete 
 e0d55fdb4d15 Downloading [>                                                  ]    534kB/109MB
 eb77aa907276 Downloading [===================>                               ]  345.4MB/907.7MB
 b0a0cf830b12 Extracting [=======================>                           ]  13.57MB/29.15MB
 e0d55fdb4d15 Downloading [======>                                            ]   14.4MB/109MB
 f9dd052e142d Extracting [===============================================>   ]  49.28MB/52.33MB
 e0d55fdb4d15 Downloading [============>                                      ]  28.25MB/109MB
 eb77aa907276 Downloading [===================>                               ]  355.6MB/907.7MB
 b0a0cf830b12 Extracting [============================>                      ]  16.81MB/29.15MB
 e0d55fdb4d15 Downloading [=====================>                             ]   46.4MB/109MB
 b0a0cf830b12 Extracting [===================================>               ]  20.64MB/29.15MB
 eb77aa907276 Downloading [====================>                              ]  370.5MB/907.7MB
 c1cb13b19080 Downloading [====>                                              ]     934B/9.925kB
 c1cb13b19080 Downloading [==================================================>]  9.925kB/9.925kB
 c1cb13b19080 Verifying Checksum 
 c1cb13b19080 Download complete 
 eb77aa907276 Downloading [=====================>                             ]  388.6MB/907.7MB
 e0d55fdb4d15 Downloading [============================>                      ]  61.34MB/109MB
 b0a0cf830b12 Extracting [========================================>          ]  23.89MB/29.15MB
 e0d55fdb4d15 Downloading [==================================>                ]  75.17MB/109MB
 eb77aa907276 Downloading [======================>                            ]  399.8MB/907.7MB
 e0d55fdb4d15 Downloading [=========================================>         ]  89.61MB/109MB
 873532e5f8c7 Downloading [==================================================>]     128B/128B
 873532e5f8c7 Verifying Checksum 
 873532e5f8c7 Download complete 
 eb77aa907276 Downloading [=======================>                           ]  419.1MB/907.7MB
 f9dd052e142d Extracting [=================================================> ]  51.38MB/52.33MB
 b0a0cf830b12 Extracting [==========================================>        ]  24.77MB/29.15MB
 e0d55fdb4d15 Downloading [=============================================>     ]  99.74MB/109MB
 eb77aa907276 Downloading [=======================>                           ]  435.6MB/907.7MB
 e0d55fdb4d15 Verifying Checksum 
 e0d55fdb4d15 Download complete 
 b0a0cf830b12 Extracting [===============================================>   ]  27.43MB/29.15MB
 eb77aa907276 Downloading [========================>                          ]  451.5MB/907.7MB
 050d9f8c3b1c Downloading [==================================================>]     169B/169B
 050d9f8c3b1c Verifying Checksum 
 050d9f8c3b1c Download complete 
 eb77aa907276 Downloading [=========================>                         ]  458.5MB/907.7MB
 b0a0cf830b12 Extracting [===============================================>   ]  27.72MB/29.15MB
 f9dd052e142d Extracting [=================================================> ]   51.9MB/52.33MB
 f9dd052e142d Extracting [==================================================>]  52.33MB/52.33MB
 eb77aa907276 Downloading [=========================>                         ]  471.8MB/907.7MB
 b0a0cf830b12 Extracting [================================================>  ]  28.02MB/29.15MB
 710e142705f8 Downloading [========>                                          ]     933B/5.421kB
 710e142705f8 Downloading [==================================================>]  5.421kB/5.421kB
 710e142705f8 Verifying Checksum 
 710e142705f8 Download complete 
 cb628c265f09 Downloading [==================================================>]     184B/184B
 cb628c265f09 Verifying Checksum 
 cb628c265f09 Download complete 
 eb77aa907276 Downloading [==========================>                        ]  477.7MB/907.7MB
 f9dd052e142d Pull complete 
 e8c6d4883897 Extracting [>                                                  ]  65.54kB/4.398MB
 eb77aa907276 Downloading [===========================>                       ]  492.7MB/907.7MB
 20043066d3d5 Downloading [>                                                  ]  299.1kB/29.72MB
 eb77aa907276 Downloading [===========================>                       ]  499.1MB/907.7MB
 20043066d3d5 Downloading [=============>                                     ]  8.263MB/29.72MB
 fbda4a386d13 Downloading [>                                                  ]  437.3kB/43.48MB
 eb77aa907276 Downloading [============================>                      ]  511.9MB/907.7MB
 20043066d3d5 Downloading [============================================>      ]  26.65MB/29.72MB
 fbda4a386d13 Downloading [======>                                            ]  5.325MB/43.48MB
 20043066d3d5 Downloading [==============================================>    ]  27.56MB/29.72MB
 20043066d3d5 Verifying Checksum 
 20043066d3d5 Download complete 
 eb77aa907276 Downloading [============================>                      ]  515.6MB/907.7MB
 b0a0cf830b12 Extracting [================================================>  ]  28.31MB/29.15MB
 eb77aa907276 Downloading [=============================>                     ]  528.9MB/907.7MB
 fbda4a386d13 Downloading [========================>                          ]  21.25MB/43.48MB
 b0a0cf830b12 Extracting [==================================================>]  29.15MB/29.15MB
 eb77aa907276 Downloading [==============================>                    ]  545.5MB/907.7MB
 fbda4a386d13 Downloading [====================================>              ]  31.42MB/43.48MB
 e8c6d4883897 Extracting [==>                                                ]  262.1kB/4.398MB
 257b1af0856e Downloading [>                                                  ]  75.84kB/7.468MB
 257b1af0856e Verifying Checksum 
 257b1af0856e Download complete 
 eb77aa907276 Downloading [==============================>                    ]  551.3MB/907.7MB
 fbda4a386d13 Downloading [====================================>              ]  31.87MB/43.48MB
 20043066d3d5 Extracting [>                                                  ]  327.7kB/29.72MB
 eb77aa907276 Downloading [==============================>                    ]  555.1MB/907.7MB
 b0a0cf830b12 Pull complete 
 dda3d8fbd5ed Extracting [==================================================>]  1.165kB/1.165kB
 dda3d8fbd5ed Extracting [==================================================>]  1.165kB/1.165kB
 fbda4a386d13 Downloading [=========================================>         ]  36.32MB/43.48MB
 e8c6d4883897 Extracting [========>                                          ]  720.9kB/4.398MB
 20043066d3d5 Extracting [==>                                                ]  1.638MB/29.72MB
 fbda4a386d13 Verifying Checksum 
 fbda4a386d13 Download complete 
 e5fbc57eeafe Downloading [====>                                              ]     934B/9.472kB
 e5fbc57eeafe Downloading [==================================================>]  9.472kB/9.472kB
 e5fbc57eeafe Download complete 
 eb77aa907276 Downloading [===============================>                   ]  567.4MB/907.7MB
 e8c6d4883897 Extracting [==============>                                    ]  1.311MB/4.398MB
 20043066d3d5 Extracting [===>                                               ]  1.966MB/29.72MB
 eb77aa907276 Downloading [===============================>                   ]  572.8MB/907.7MB
 e8c6d4883897 Extracting [===================>                               ]  1.704MB/4.398MB
 eb77aa907276 Downloading [================================>                  ]  585.6MB/907.7MB
 20043066d3d5 Extracting [====>                                              ]  2.621MB/29.72MB
 0f9a1c409bb2 Downloading [==================================================>]     188B/188B
 0f9a1c409bb2 Verifying Checksum 
 0f9a1c409bb2 Download complete 
 dda3d8fbd5ed Pull complete 
 e06b5a47837d Pull complete 
 e8c6d4883897 Extracting [====================>                              ]  1.769MB/4.398MB
 306343d42fe6 Extracting [=>                                                 ]  32.77kB/1.438MB
 283a477db7bb Extracting [>                                                  ]  65.54kB/4.533MB
 f19b7ac6489f Downloading [>                                                  ]  215.1kB/21.31MB
 20043066d3d5 Extracting [=========>                                         ]  5.898MB/29.72MB
 306343d42fe6 Extracting [==================================================>]  1.438MB/1.438MB
 eb77aa907276 Downloading [================================>                  ]  596.2MB/907.7MB
 f19b7ac6489f Verifying Checksum 
 f19b7ac6489f Download complete 
 283a477db7bb Extracting [==========================>                        ]  2.359MB/4.533MB
 e8c6d4883897 Extracting [============================>                      ]   2.49MB/4.398MB
 306343d42fe6 Pull complete 
 56a10b9d0fdd Extracting [>                                                  ]  163.8kB/15.35MB
 eb77aa907276 Downloading [=================================>                 ]  605.8MB/907.7MB
 20043066d3d5 Extracting [============>                                      ]  7.209MB/29.72MB
 283a477db7bb Extracting [=================================================> ]  4.456MB/4.533MB
 e8c6d4883897 Extracting [===================================>               ]  3.146MB/4.398MB
 283a477db7bb Extracting [==================================================>]  4.533MB/4.533MB
 56a10b9d0fdd Extracting [===========>                                       ]  3.604MB/15.35MB
 d5d9860a5545 Downloading [==================================================>]     109B/109B
 d5d9860a5545 Verifying Checksum 
 d5d9860a5545 Download complete 
 20043066d3d5 Extracting [==============>                                    ]   8.52MB/29.72MB
 eb77aa907276 Downloading [==================================>                ]  620.3MB/907.7MB
 e8c6d4883897 Extracting [=======================================>           ]  3.473MB/4.398MB
 fc030d7bf8ba Downloading [==================================================>]     617B/617B
 fc030d7bf8ba Verifying Checksum 
 fc030d7bf8ba Download complete 
 56a10b9d0fdd Extracting [========================>                          ]  7.537MB/15.35MB
 283a477db7bb Pull complete 
 91d2729fa4d5 Extracting [=>                                                 ]  32.77kB/1.45MB
 eb77aa907276 Downloading [==================================>                ]    632MB/907.7MB
 20043066d3d5 Extracting [=================>                                 ]  10.16MB/29.72MB
 91d2729fa4d5 Extracting [==================================================>]   1.45MB/1.45MB
 e8c6d4883897 Extracting [==================================================>]  4.398MB/4.398MB
 91d2729fa4d5 Pull complete 
 e8c6d4883897 Pull complete 
 648eb81b3252 Extracting [==================================================>]  1.561kB/1.561kB
 648eb81b3252 Extracting [==================================================>]  1.561kB/1.561kB
 9739ced65621 Extracting [>                                                  ]   98.3kB/8.069MB
 56a10b9d0fdd Extracting [=====================================>             ]  11.47MB/15.35MB
 eb77aa907276 Downloading [===================================>               ]    640MB/907.7MB
 648eb81b3252 Pull complete 
 20043066d3d5 Extracting [======================>                            ]  13.43MB/29.72MB
 c5ec72a0a4d4 Downloading [==================================================>]     831B/831B
 c5ec72a0a4d4 Verifying Checksum 
 c5ec72a0a4d4 Download complete 
 9739ced65621 Extracting [===============>                                   ]  2.556MB/8.069MB
 56a10b9d0fdd Extracting [=================================================> ]  15.24MB/15.35MB
 56a10b9d0fdd Extracting [==================================================>]  15.35MB/15.35MB
 eb77aa907276 Downloading [====================================>              ]  657.6MB/907.7MB
 a51622689fc8 Downloading [>                                                  ]    125kB/12.47MB
 20043066d3d5 Extracting [=============================>                     ]  17.69MB/29.72MB
 56a10b9d0fdd Pull complete 
 fa42f65f0d3f Extracting [==================================================>]      97B/97B
 fa42f65f0d3f Extracting [==================================================>]      97B/97B
 fa42f65f0d3f Pull complete 
 4f4fb700ef54 Extracting [==================================================>]      32B/32B
 4f4fb700ef54 Extracting [==================================================>]      32B/32B
 4f4fb700ef54 Pull complete 
 9e749293ebb8 Extracting [==================================================>]     572B/572B
 9e749293ebb8 Extracting [==================================================>]     572B/572B
 a51622689fc8 Verifying Checksum 
 a51622689fc8 Download complete 
 9739ced65621 Extracting [=======================>                           ]  3.834MB/8.069MB
 9e749293ebb8 Pull complete 
 eb77aa907276 Downloading [====================================>              ]  670.9MB/907.7MB
 redis Pulled 
 20043066d3d5 Extracting [=====================================>             ]  22.28MB/29.72MB
 9739ced65621 Extracting [===================================>               ]    5.8MB/8.069MB
 eb77aa907276 Downloading [=====================================>             ]  677.8MB/907.7MB
 9739ced65621 Extracting [==================================================>]  8.069MB/8.069MB
 eb77aa907276 Downloading [=====================================>             ]  684.8MB/907.7MB
 20043066d3d5 Extracting [==========================================>        ]  25.56MB/29.72MB
 9739ced65621 Pull complete 
 ae3bb1b347a4 Extracting [=>                                                 ]  32.77kB/1.196MB
 ae3bb1b347a4 Extracting [==================================================>]  1.196MB/1.196MB
 ae3bb1b347a4 Extracting [==================================================>]  1.196MB/1.196MB
 eb77aa907276 Downloading [======================================>            ]  690.7MB/907.7MB
 ae3bb1b347a4 Pull complete 
 f8406d9c00ea Extracting [==================================================>]     116B/116B
 f8406d9c00ea Extracting [==================================================>]     116B/116B
 20043066d3d5 Extracting [==============================================>    ]  27.85MB/29.72MB
 f8406d9c00ea Pull complete 
 c199bff16b05 Extracting [==================================================>]  3.145kB/3.145kB
 c199bff16b05 Extracting [==================================================>]  3.145kB/3.145kB
 c199bff16b05 Pull complete 
 eb77aa907276 Downloading [======================================>            ]  697.1MB/907.7MB
 e0d55fdb4d15 Extracting [>                                                  ]  557.1kB/109MB
 20043066d3d5 Extracting [=================================================> ]  29.16MB/29.72MB
 eb77aa907276 Downloading [======================================>            ]  702.4MB/907.7MB
 20043066d3d5 Extracting [=================================================> ]  29.49MB/29.72MB
 e0d55fdb4d15 Extracting [===>                                               ]  7.242MB/109MB
 20043066d3d5 Extracting [==================================================>]  29.72MB/29.72MB
 eb77aa907276 Downloading [======================================>            ]  706.7MB/907.7MB
 e0d55fdb4d15 Extracting [====>                                              ]  10.03MB/109MB
 20043066d3d5 Pull complete 
 fbda4a386d13 Extracting [>                                                  ]  458.8kB/43.48MB
 eb77aa907276 Downloading [=======================================>           ]  717.9MB/907.7MB
 e0d55fdb4d15 Extracting [======>                                            ]  13.93MB/109MB
 fbda4a386d13 Extracting [=========>                                         ]  8.258MB/43.48MB
 eb77aa907276 Downloading [========================================>          ]  735.5MB/907.7MB
 e0d55fdb4d15 Extracting [=======>                                           ]  17.27MB/109MB
 fbda4a386d13 Extracting [=================>                                 ]  15.14MB/43.48MB
 eb77aa907276 Downloading [=========================================>         ]  745.1MB/907.7MB
 e0d55fdb4d15 Extracting [==========>                                        ]  22.28MB/109MB
 fbda4a386d13 Extracting [=========================>                         ]  22.48MB/43.48MB
 eb77aa907276 Downloading [=========================================>         ]  748.3MB/907.7MB
 fbda4a386d13 Extracting [=================================>                 ]   28.9MB/43.48MB
 e0d55fdb4d15 Extracting [============>                                      ]  26.74MB/109MB
 eb77aa907276 Downloading [=========================================>         ]  758.4MB/907.7MB
 fbda4a386d13 Extracting [=======================================>           ]  34.41MB/43.48MB
 e0d55fdb4d15 Extracting [================>                                  ]  35.09MB/109MB
 eb77aa907276 Downloading [==========================================>        ]  762.6MB/907.7MB
 fbda4a386d13 Extracting [================================================>  ]  41.75MB/43.48MB
 e0d55fdb4d15 Extracting [===================>                               ]  42.89MB/109MB
 fbda4a386d13 Extracting [==================================================>]  43.48MB/43.48MB
 eb77aa907276 Downloading [==========================================>        ]  770.7MB/907.7MB
 e0d55fdb4d15 Extracting [=======================>                           ]  50.14MB/109MB
 eb77aa907276 Downloading [==========================================>        ]  777.1MB/907.7MB
 e0d55fdb4d15 Extracting [========================>                          ]  53.48MB/109MB
 eb77aa907276 Downloading [===========================================>       ]  785.1MB/907.7MB
 e0d55fdb4d15 Extracting [===========================>                       ]  59.05MB/109MB
 fbda4a386d13 Pull complete 
 257b1af0856e Extracting [>                                                  ]   98.3kB/7.468MB
 eb77aa907276 Downloading [===========================================>       ]  789.9MB/907.7MB
 e0d55fdb4d15 Extracting [=============================>                     ]  64.06MB/109MB
 257b1af0856e Extracting [=================>                                 ]  2.654MB/7.468MB
 e0d55fdb4d15 Extracting [=================================>                 ]  72.42MB/109MB
 eb77aa907276 Downloading [===========================================>       ]  797.3MB/907.7MB
 257b1af0856e Extracting [==================================================>]  7.468MB/7.468MB
 e0d55fdb4d15 Extracting [===================================>               ]  77.43MB/109MB
 257b1af0856e Pull complete 
 e5fbc57eeafe Extracting [==================================================>]  9.472kB/9.472kB
 eb77aa907276 Downloading [============================================>      ]  806.4MB/907.7MB
 e5fbc57eeafe Pull complete 
 f19b7ac6489f Extracting [>                                                  ]  229.4kB/21.31MB
 e0d55fdb4d15 Extracting [======================================>            ]  84.67MB/109MB
 eb77aa907276 Downloading [============================================>      ]  810.1MB/907.7MB
 f19b7ac6489f Extracting [=========>                                         ]  4.129MB/21.31MB
 e0d55fdb4d15 Extracting [=========================================>         ]  91.36MB/109MB
 eb77aa907276 Downloading [=============================================>     ]  822.3MB/907.7MB
 f19b7ac6489f Extracting [===================>                               ]  8.487MB/21.31MB
 eb77aa907276 Downloading [==============================================>    ]  836.2MB/907.7MB
 e0d55fdb4d15 Extracting [==========================================>        ]  93.59MB/109MB
 f19b7ac6489f Extracting [===========================>                       ]   11.7MB/21.31MB
 eb77aa907276 Downloading [==============================================>    ]  852.7MB/907.7MB
 e0d55fdb4d15 Extracting [============================================>      ]  96.93MB/109MB
 f19b7ac6489f Extracting [==================================>                ]  14.91MB/21.31MB
 eb77aa907276 Downloading [===============================================>   ]  864.5MB/907.7MB
 e0d55fdb4d15 Extracting [=============================================>     ]  99.16MB/109MB
 f19b7ac6489f Extracting [======================================>            ]  16.52MB/21.31MB
 eb77aa907276 Downloading [================================================>  ]  875.7MB/907.7MB
 e0d55fdb4d15 Extracting [==============================================>    ]  101.9MB/109MB
 f19b7ac6489f Extracting [==========================================>        ]  18.12MB/21.31MB
 eb77aa907276 Downloading [================================================>  ]  883.7MB/907.7MB
 e0d55fdb4d15 Extracting [===============================================>   ]  103.6MB/109MB
 f19b7ac6489f Extracting [================================================>  ]  20.64MB/21.31MB
 eb77aa907276 Downloading [=================================================> ]  894.9MB/907.7MB
 e0d55fdb4d15 Extracting [================================================>  ]  105.3MB/109MB
 eb77aa907276 Verifying Checksum 
 eb77aa907276 Download complete 
 f19b7ac6489f Extracting [================================================>  ]  20.87MB/21.31MB
 f19b7ac6489f Extracting [==================================================>]  21.31MB/21.31MB
 eb77aa907276 Extracting [>                                                  ]  557.1kB/907.7MB
 f19b7ac6489f Pull complete 
 0f9a1c409bb2 Extracting [==================================================>]     188B/188B
 0f9a1c409bb2 Extracting [==================================================>]     188B/188B
 e0d55fdb4d15 Extracting [=================================================> ]    107MB/109MB
 0f9a1c409bb2 Pull complete 
 d5d9860a5545 Extracting [==================================================>]     109B/109B
 d5d9860a5545 Extracting [==================================================>]     109B/109B
 eb77aa907276 Extracting [>                                                  ]  11.14MB/907.7MB
 eb77aa907276 Extracting [=>                                                 ]  28.97MB/907.7MB
 eb77aa907276 Extracting [==>                                                ]  42.34MB/907.7MB
 e0d55fdb4d15 Extracting [=================================================> ]  107.5MB/109MB
 eb77aa907276 Extracting [===>                                               ]  55.71MB/907.7MB
 d5d9860a5545 Pull complete 
 fc030d7bf8ba Extracting [==================================================>]     617B/617B
 fc030d7bf8ba Extracting [==================================================>]     617B/617B
 fc030d7bf8ba Pull complete 
 c5ec72a0a4d4 Extracting [==================================================>]     831B/831B
 c5ec72a0a4d4 Extracting [==================================================>]     831B/831B
 c5ec72a0a4d4 Pull complete 
 a51622689fc8 Extracting [>                                                  ]  131.1kB/12.47MB
 eb77aa907276 Extracting [===>                                               ]  69.63MB/907.7MB
 e0d55fdb4d15 Extracting [=================================================> ]  108.1MB/109MB
 a51622689fc8 Extracting [===============>                                   ]  3.932MB/12.47MB
 e0d55fdb4d15 Extracting [==================================================>]    109MB/109MB
 a51622689fc8 Extracting [=======================>                           ]  5.898MB/12.47MB
 eb77aa907276 Extracting [====>                                              ]  81.89MB/907.7MB
 e0d55fdb4d15 Pull complete 
 c1cb13b19080 Extracting [==================================================>]  9.925kB/9.925kB
 c1cb13b19080 Extracting [==================================================>]  9.925kB/9.925kB
 c1cb13b19080 Pull complete 
 873532e5f8c7 Extracting [==================================================>]     128B/128B
 873532e5f8c7 Extracting [==================================================>]     128B/128B
 873532e5f8c7 Pull complete 
 050d9f8c3b1c Extracting [==================================================>]     169B/169B
 050d9f8c3b1c Extracting [==================================================>]     169B/169B
 a51622689fc8 Extracting [==========================>                        ]  6.685MB/12.47MB
 050d9f8c3b1c Pull complete 
 eb77aa907276 Extracting [=====>                                             ]   90.8MB/907.7MB
 710e142705f8 Extracting [==================================================>]  5.421kB/5.421kB
 710e142705f8 Extracting [==================================================>]  5.421kB/5.421kB
 710e142705f8 Pull complete 
 cb628c265f09 Extracting [==================================================>]     184B/184B
 cb628c265f09 Extracting [==================================================>]     184B/184B
 cb628c265f09 Pull complete 
 postgresql Pulled 
 a51622689fc8 Extracting [==================================>                ]   8.52MB/12.47MB
 eb77aa907276 Extracting [=====>                                             ]  98.04MB/907.7MB
 a51622689fc8 Extracting [=========================================>         ]  10.35MB/12.47MB
 eb77aa907276 Extracting [=====>                                             ]  105.3MB/907.7MB
 a51622689fc8 Extracting [==================================================>]  12.47MB/12.47MB
 eb77aa907276 Extracting [======>                                            ]  113.6MB/907.7MB
 a51622689fc8 Pull complete 
 rabbitmq Pulled 
 eb77aa907276 Extracting [======>                                            ]  120.9MB/907.7MB
 eb77aa907276 Extracting [=======>                                           ]  129.8MB/907.7MB
 eb77aa907276 Extracting [=======>                                           ]  138.1MB/907.7MB
 eb77aa907276 Extracting [========>                                          ]  145.9MB/907.7MB
 eb77aa907276 Extracting [========>                                          ]  154.9MB/907.7MB
 eb77aa907276 Extracting [=========>                                         ]  168.2MB/907.7MB
 eb77aa907276 Extracting [==========>                                        ]  190.5MB/907.7MB
 eb77aa907276 Extracting [===========>                                       ]    210MB/907.7MB
 eb77aa907276 Extracting [============>                                      ]  221.2MB/907.7MB
 eb77aa907276 Extracting [============>                                      ]  231.7MB/907.7MB
 eb77aa907276 Extracting [=============>                                     ]  241.8MB/907.7MB
 eb77aa907276 Extracting [==============>                                    ]  258.5MB/907.7MB
 eb77aa907276 Extracting [===============>                                   ]  280.8MB/907.7MB
 eb77aa907276 Extracting [================>                                  ]  306.4MB/907.7MB
 eb77aa907276 Extracting [==================>                                ]  327.5MB/907.7MB
 eb77aa907276 Extracting [===================>                               ]  349.8MB/907.7MB
 eb77aa907276 Extracting [====================>                              ]  363.2MB/907.7MB
 eb77aa907276 Extracting [====================>                              ]    371MB/907.7MB
 eb77aa907276 Extracting [=====================>                             ]  387.2MB/907.7MB
 eb77aa907276 Extracting [======================>                            ]  409.4MB/907.7MB
 eb77aa907276 Extracting [========================>                          ]  437.8MB/907.7MB
 eb77aa907276 Extracting [=========================>                         ]  466.8MB/907.7MB
 eb77aa907276 Extracting [===========================>                       ]  495.8MB/907.7MB
 eb77aa907276 Extracting [============================>                      ]  525.3MB/907.7MB
 eb77aa907276 Extracting [==============================>                    ]  554.3MB/907.7MB
 eb77aa907276 Extracting [================================>                  ]  582.7MB/907.7MB
 eb77aa907276 Extracting [=================================>                 ]  611.1MB/907.7MB
 eb77aa907276 Extracting [===================================>               ]  639.5MB/907.7MB
 eb77aa907276 Extracting [====================================>              ]  667.9MB/907.7MB
 eb77aa907276 Extracting [======================================>            ]  696.9MB/907.7MB
 eb77aa907276 Extracting [=======================================>           ]  722.5MB/907.7MB
 eb77aa907276 Extracting [=========================================>         ]  747.6MB/907.7MB
 eb77aa907276 Extracting [==========================================>        ]  770.4MB/907.7MB
 eb77aa907276 Extracting [===========================================>       ]  791.6MB/907.7MB
 eb77aa907276 Extracting [============================================>      ]  813.9MB/907.7MB
 eb77aa907276 Extracting [==============================================>    ]  835.6MB/907.7MB
 eb77aa907276 Extracting [===============================================>   ]  856.8MB/907.7MB
 eb77aa907276 Extracting [================================================>  ]    879MB/907.7MB
 eb77aa907276 Extracting [=================================================> ]  901.9MB/907.7MB
 eb77aa907276 Extracting [==================================================>]  907.7MB/907.7MB
 eb77aa907276 Pull complete 
 4f4fb700ef54 Extracting [==================================================>]      32B/32B
 4f4fb700ef54 Extracting [==================================================>]      32B/32B
 4f4fb700ef54 Pull complete 
 0ffa8f8aba1e Extracting [==================================================>]     226B/226B
 0ffa8f8aba1e Extracting [==================================================>]     226B/226B
 0ffa8f8aba1e Pull complete 
 2e81b9cb93cd Extracting [==================================================>]  1.859kB/1.859kB
 2e81b9cb93cd Extracting [==================================================>]  1.859kB/1.859kB
 2e81b9cb93cd Pull complete 
 opensearch Pulled 
 Network docker_services_cli_default  Creating
 Network docker_services_cli_default  Created
 Container docker_services_cli-postgresql-1  Creating
 Container docker_services_cli-redis-1  Creating
 Container docker_services_cli-rabbitmq-1  Creating
 Container docker_services_cli-opensearch-1  Creating
 Container docker_services_cli-redis-1  Created
 Container docker_services_cli-opensearch-1  Created
 Container docker_services_cli-postgresql-1  Created
 Container docker_services_cli-rabbitmq-1  Created
 Container docker_services_cli-rabbitmq-1  Starting
 Container docker_services_cli-redis-1  Starting
 Container docker_services_cli-opensearch-1  Starting
 Container docker_services_cli-postgresql-1  Starting
 Container docker_services_cli-postgresql-1  Started
 Container docker_services_cli-redis-1  Started
 Container docker_services_cli-rabbitmq-1  Started
 Container docker_services_cli-opensearch-1  Started
============================= test session starts ==============================
platform linux -- Python 3.12.12, pytest-8.4.2, pluggy-1.6.0 -- /home/runner/work/invenio-bug-verification/invenio-bug-verification/package-repo/.venv/bin/python
cachedir: .pytest_cache
rootdir: /home/runner/work/invenio-bug-verification/invenio-bug-verification/package-repo
configfile: pyproject.toml
testpaths: docs, tests, invenio_sitemap
plugins: github-actions-annotate-failures-0.3.0, pycodestyle-2.5.0, flask-1.3.0, black-ng-0.4.1, invenio-3.4.2, isort-4.0.0, cov-7.0.0, pydocstyle-2.4.0
collecting ... collected 65 items

docs/conf.py::PYDOCSTYLE PASSED
docs/conf.py::ISORT PASSED
docs/conf.py::black PASSED
tests/__init__.py::PYDOCSTYLE PASSED
tests/__init__.py::ISORT PASSED
tests/__init__.py::black PASSED
tests/conftest.py::PYDOCSTYLE PASSED
tests/conftest.py::ISORT PASSED
tests/conftest.py::black PASSED
tests/fake_sitemap_sections.py::PYDOCSTYLE PASSED
tests/fake_sitemap_sections.py::ISORT PASSED
tests/fake_sitemap_sections.py::black PASSED
tests/test_cache.py::ISORT PASSED
tests/test_cache.py::black PASSED
tests/test_cache.py::test_base_sitemap_cache_iterate_keys PASSED
tests/test_invenio_sitemap.py::ISORT PASSED
tests/test_invenio_sitemap.py::black PASSED
tests/test_invenio_sitemap.py::test_version PASSED
tests/test_invenio_sitemap.py::test_init PASSED
tests/test_invenio_sitemap.py::test_config_defaults PASSED
tests/test_invenio_sitemap.py::test_config_override PASSED
tests/test_sitemap.py::ISORT PASSED
tests/test_sitemap.py::black PASSED
tests/test_sitemap.py::test_url_entries_generation PASSED::warning file=/home/runner/work/invenio-bug-verification/invenio-bug-verification/package-repo/.venv/lib/python3.12/site-packages/flask_caching/__init__.py,line=145::Using the initialization functions in flask_caching.backend is deprecated.  Use the a full path to backend classes directly.
::warning file=/home/runner/work/invenio-bug-verification/invenio-bug-verification/package-repo/.venv/lib/python3.12/site-packages/flask_caching/__init__.py,line=145::Using the initialization functions in flask_caching.backend is deprecated.  Use the a full path to backend classes directly.

tests/test_sitemap.py::test_latest_lastmod PASSED
tests/test_sitemap.py::test_sitemap_404 PASSED
tests/test_sitemap.py::test_sitemap_has_valid_structure PASSED
tests/test_sitemap.py::test_sitemap_content PASSED
tests/test_sitemap.py::test_urls_eliminated_between_cache_refresh PASSED
tests/test_sitemap_index.py::ISORT PASSED
tests/test_sitemap_index.py::black PASSED
tests/test_sitemap_index.py::test_sitemap_entries_generation PASSED::warning file=/home/runner/work/invenio-bug-verification/invenio-bug-verification/package-repo/.venv/lib/python3.12/site-packages/flask_caching/__init__.py,line=145::Using the initialization functions in flask_caching.backend is deprecated.  Use the a full path to backend classes directly.
::warning file=/home/runner/work/invenio-bug-verification/invenio-bug-verification/package-repo/.venv/lib/python3.12/site-packages/flask_caching/__init__.py,line=145::Using the initialization functions in flask_caching.backend is deprecated.  Use the a full path to backend classes directly.

tests/test_sitemap_index.py::test_sitemap_index_has_valid_structure PASSED
tests/test_sitemap_index.py::test_sitemap_index_content PASSED
tests/test_sitemap_index.py::test_iterate_urls_of_sitemap_indices PASSED
tests/test_sitemap_root.py::ISORT PASSED
tests/test_sitemap_root.py::black PASSED
tests/test_sitemap_root.py::test_sitemap_root_enabled_by_default PASSED::warning file=/home/runner/work/invenio-bug-verification/invenio-bug-verification/package-repo/.venv/lib/python3.12/site-packages/flask_caching/__init__.py,line=145::Using the initialization functions in flask_caching.backend is deprecated.  Use the a full path to backend classes directly.
::warning file=/home/runner/work/invenio-bug-verification/invenio-bug-verification/package-repo/.venv/lib/python3.12/site-packages/flask_caching/__init__.py,line=145::Using the initialization functions in flask_caching.backend is deprecated.  Use the a full path to backend classes directly.

tests/test_sitemap_root.py::test_sitemap_root_disabled_when_configured PASSED
tests/test_sitemap_root.py::test_sitemap_root_empty_cache PASSED
tests/test_sitemap_root.py::test_sitemap_root_only_first_page PASSED
invenio_sitemap/__init__.py::PYDOCSTYLE PASSED
invenio_sitemap/__init__.py::ISORT PASSED
invenio_sitemap/__init__.py::black PASSED
invenio_sitemap/cache.py::PYDOCSTYLE PASSED
invenio_sitemap/cache.py::ISORT PASSED
invenio_sitemap/cache.py::black PASSED
invenio_sitemap/config.py::PYDOCSTYLE PASSED
invenio_sitemap/config.py::ISORT PASSED
invenio_sitemap/config.py::black PASSED
invenio_sitemap/ext.py::PYDOCSTYLE PASSED
invenio_sitemap/ext.py::ISORT PASSED
invenio_sitemap/ext.py::black PASSED
invenio_sitemap/sitemap.py::PYDOCSTYLE PASSED
invenio_sitemap/sitemap.py::ISORT PASSED
invenio_sitemap/sitemap.py::black PASSED
invenio_sitemap/tasks.py::PYDOCSTYLE PASSED
invenio_sitemap/tasks.py::ISORT PASSED
invenio_sitemap/tasks.py::black PASSED
invenio_sitemap/utils.py::PYDOCSTYLE PASSED
invenio_sitemap/utils.py::ISORT PASSED
invenio_sitemap/utils.py::black PASSED
invenio_sitemap/views.py::PYDOCSTYLE PASSED
invenio_sitemap/views.py::ISORT PASSED
invenio_sitemap/views.py::black PASSED

=============================== warnings summary ===============================
tests/test_sitemap.py::test_url_entries_generation
tests/test_sitemap.py::test_url_entries_generation
tests/test_sitemap_index.py::test_sitemap_entries_generation
tests/test_sitemap_index.py::test_sitemap_entries_generation
tests/test_sitemap_root.py::test_sitemap_root_enabled_by_default
tests/test_sitemap_root.py::test_sitemap_root_enabled_by_default
  /home/runner/work/invenio-bug-verification/invenio-bug-verification/package-repo/.venv/lib/python3.12/site-packages/flask_caching/__init__.py:145: DeprecationWarning: Using the initialization functions in flask_caching.backend is deprecated.  Use the a full path to backend classes directly.
    self._set_cache(app, config)

-- Docs: https://docs.pytest.org/en/stable/how-to/capture-warnings.html
- generated xml file: /home/runner/work/invenio-bug-verification/invenio-bug-verification/artifacts/test-report-patched.xml -
================================ tests coverage ================================
_______________ coverage: platform linux, python 3.12.12-final-0 _______________

Name                          Stmts   Miss  Cover   Missing
-----------------------------------------------------------
invenio_sitemap/__init__.py       6      0   100%
invenio_sitemap/cache.py         34      1    97%   60
invenio_sitemap/config.py         6      0   100%
invenio_sitemap/ext.py           12      0   100%
invenio_sitemap/sitemap.py        6      0   100%
invenio_sitemap/tasks.py         49      1    98%   66
invenio_sitemap/utils.py         13      0   100%
invenio_sitemap/views.py         31      0   100%
-----------------------------------------------------------
TOTAL                           157      2    99%
======================= 65 passed, 6 warnings in 10.23s ========================
 Container docker_services_cli-rabbitmq-1  Stopping
 Container docker_services_cli-postgresql-1  Stopping
 Container docker_services_cli-opensearch-1  Stopping
 Container docker_services_cli-redis-1  Stopping
 Container docker_services_cli-redis-1  Stopped
 Container docker_services_cli-redis-1  Removing
 Container docker_services_cli-postgresql-1  Stopped
 Container docker_services_cli-postgresql-1  Removing
 Container docker_services_cli-postgresql-1  Removed
 Container docker_services_cli-redis-1  Removed
 Container docker_services_cli-opensearch-1  Stopped
 Container docker_services_cli-opensearch-1  Removing
 Container docker_services_cli-opensearch-1  Removed
 Container docker_services_cli-rabbitmq-1  Stopped
 Container docker_services_cli-rabbitmq-1  Removing
 Container docker_services_cli-rabbitmq-1  Removed
 Network docker_services_cli_default  Removing
 Network docker_services_cli_default  Removed
